PREFEITURA MUNICIPAL DE TOUROS;PREFEITURA MUNICIPAL DE TOUROS;08234155000102;PRACA BOM JESUS;28;;CENTRO;TOUROS;59584000;RN
PREFEITURA MUNICIPAL DE TRIUNFO POTIGUAR;PREFEITURA MUNICIPAL DE TRIUNFO POTIGUAR;01612376000110;RUA JOSE EUFRAZIO;148;;CENTRO;TRIUNFO POTIGUAR;59685000;RN
PREFEITURA MUNICIPAL DE UMARIZAL;PREFEITURA MUNICIPAL DE UMARIZAL;08348963000192;AV GAVIAO;19;;CENTRO;UMARIZAL;59865000;RN
PREFEITURA MUNICIPAL DE UPANEMA;PREFEITURA MUNICIPAL DE UPANEMA;08085771000130;RUA JOAO FRANCISCO;90;;CENTRO;UPANEMA;59670000;RN
PREFEITURA MUNICIPAL DE VARZEA;PREFEITURA MUNICIPAL DE VARZEA;08168940000104;RUA CEL FELIPE JORGE;42;;CENTRO;VARZEA;59185000;RN
PREFEITURA MUNICIPAL DE VENHA-VER;PREFEITURA MUNICIPAL DE VENHA-VER;01612380000188;RUA ANTONIO MARTINS;13;;CENTRO;VENHA-VER;59925000;RN
PREFEITURA MUNICIPAL DE VERA CRUZ;PREFEITURA MUNICIPAL DE VERA CRUZ;08362915000159;RUA MONSENHOR PAIVA;;;CENTRO;VERA CRUZ;59184000;RN
PREFEITURA MUNICIPAL DE VICOSA;PREFEITURA MUNICIPAL DE VICOSA;08158198000148;RUA OZEAS PINTO;140;;CENTRO;VICOSA;59815000;RN
PREFEITURA MUNICIPAL DE VILA FLOR;PREFEITURA MUNICIPAL DE VILA FLOR;08169278000107;R JOSE CALAZANS;12;;CENTRO;VILA FLOR;59192000;RN
PREFEITURA MUNICIPAL DE ALVARAES;PREFEITURA MUNICIPAL DE ALVARAES;04628335000100;AVENIDA CASTELO BRANCO;100;;CENTRO;ALVARAES;69540000;AM
PREFEITURA MUNICIPAL DE AMATURA;PREFEITURA MUNICIPAL DE AMATURA;04628723000190;AV. 21 DE JUNHO;1746;;CENTRO;AMATURA;69620000;AM
PREFEITURA MUNICIPAL DE ANAMA;PREFEITURA MUNICIPAL DE ANAMA;04628020000162;RUA ALVARO MAIA;S/N;;CENTRO;ANAMA;69445000;AM
PREFEITURA MUNICIPAL DE ANORI;PREFEITURA MUNICIPAL DE ANORI;04262762000117;PRACA CAP PEDRO SILVA;168;;CENTRO;ANORI;69440000;AM
PREFEITURA MUNICIPAL DE APUI;PREFEITURA MUNICIPAL DE APUI;22812960000199;PRACA DOS TRES PODERES;S/N;;CENTRO;APUI;69265000;AM
PREFEITURA MUNICIPAL DE ATALAIA DO NORTE;PREFEITURA MUNICIPAL DE ATALAIA DO NORTE;04530713000118;RUA 31 DE MARÇO;S/N;;CENTRO;ATALAIA DO NORTE;69650000;AM
PREFEITURA MUNICIPAL DE AUTAZES;PREFEITURA MUNICIPAL DE AUTAZES;04477642000137;RUA FRANCISCO BARRONCAS;S/N;;SANTA LUZIA;AUTAZES;69240000;AM
PREFEITURA MUNICIPAL DE BARCELOS;PREFEITURA MUNICIPAL DE BARCELOS;04271037000105;RUA TENREIRO ARANHA;204;;CENTRO;BARCELOS;69700000;AM
PREFEITURA MUNICIPAL DE BARREIRINHA;PREFEITURA MUNICIPAL DE BARREIRINHA;04283040000149;RUA MILITAO DUTRA;S/N;;CENTRO;BARREIRINHA;69160000;AM
PREFEITURA MUNICIPAL DE BENJAMIN CONSTANT;PREFEITURA MUNICIPAL DE BENJAMIN CONSTANT;04243978000135;AVENIDA CASTELO BRANCO;S/N;;CENTRO;BENJAMIN CONSTANT;69630000;AM
PREFEITURA MUNICIPAL DE BERURI;PREFEITURA MUNICIPAL DE BERURI;04628111000106;AV CASTELO BRANCO;100;PREDIO;CENTRO;BERURI;69430000;AM
PREFEITURA MUNICIPAL DE BOA VISTA DO RAMOS;PREFEITURA MUNICIPAL DE BOA VISTA DO RAMOS;04629283000196;RUA OLAVO BILAC;390;;CENTRO;BOA VISTA DO RAMOS;69195000;AM
PREFEITURA MUNICIPAL DE BOCA DO ACRE;PREFEITURA MUNICIPAL DE BOCA DO ACRE;15811318000120;AV. CEL. JOSE ASSUNCAO NETO;S/N;;PLATO DO PIQUIA;BOCA DO ACRE;69850000;AM
PREFEITURA MUNICIPAL DE BORBA;PREFEITURA MUNICIPAL DE BORBA;04477568000159;AVENIDA SILVERIO NERY;S/N;;IPIRANGA;BORBA;69200000;AM
PREFEITURA MUNICIPAL DE CAAPIRANGA;PREFEITURA MUNICIPAL DE CAAPIRANGA;04628046000100;PC 28 DE DEZEMBRO;332;;SANTA LUZIA;CAAPIRANGA;69425000;AM
PREFEITURA MUNICIPAL DE CANUTAMA;PREFEITURA MUNICIPAL DE CANUTAMA;04247441000143;RUA FLORIANO PEIXOTO;100;;CENTRO;CANUTAMA;69820000;AM
PREFEITURA MUNICIPAL DE CARAUARI;PREFEITURA MUNICIPAL DE CARAUARI;04530044000184;AV. DOM PEDRO II;S/N;;CENTRO;CARAUARI;69500000;AM
PREFEITURA MUNICIPAL DE CAREIRO;PREFEITURA MUNICIPAL DE CAREIRO;04332995000149;AV MSRIO JORGE GUEDES DA SILVA;391;;CENTRO;CAREIRO;69250000;AM
PREFEITURA MUNICIPAL DE CAREIRO DA VARZEA;PREFEITURA MUNICIPAL DE CAREIRO DA VARZEA;23006331000134;AVENIDA JOSE RIBAMAR BARBOSA;S/N;;CENTRO;CAREIRO DA VARZEA;69255000;AM
PREFEITURA MUNICIPAL DE COARI;PREFEITURA MUNICIPAL DE COARI;04262432000121;RUA 05 DE SETEMBRO;1000;;CENTRO;COARI;69460000;AM
PREFEITURA MUNICIPAL DE CODAJAS;PREFEITURA MUNICIPAL DE CODAJAS;04263331000175;RUA 05 DE SETEMBRO;SN;CASA;CENTRO;CODAJAS;69450000;AM
PREFEITURA MUNICIPAL DE EIRUNEPE;PREFEITURA MUNICIPAL DE EIRUNEPE;04190765000192;RUA TEREZINHA;86;;CENTRO;EIRUNEPE;69880000;AM
PREFEITURA MUNICIPAL DE ENVIRA;PREFEITURA MUNICIPAL DE ENVIRA;04530895000127;RUA JOAQUIM BORBA;381;;CENTRO;ENVIRA;69870000;AM
PREFEITURA MUNICIPAL DE FONTE BOA;PREFEITURA MUNICIPAL DE FONTE BOA;04530101000125;RUA BOULEVARD ALVARO MAIA;260;A;SAO FRANCISCO I;FONTE BOA;69670000;AM
PREFEITURA MUNICIPAL DE GUAJARA;PREFEITURA MUNICIPAL DE GUAJARA;22812242000112;AV JUSTINO BERANANDES;S/N;;CENTRO;GUAJARA;69895000;AM
PREFEITURA MUNICIPAL DE HUMAITA;PREFEITURA MUNICIPAL DE HUMAITA;04465209000181;RUA CINCO DE SETEMBRO;S/N;;CENTRO;HUMAITA;69800000;AM
PREFEITURA MUNICIPAL DE IPIXUNA;PREFEITURA MUNICIPAL DE IPIXUNA;04191078000191;AV. VARCY HERCULANO BARROSO;58;PREDIO;CENTRO;IPIXUNA;69890000;AM
PREFEITURA MUNICIPAL DE IRANDUBA;PREFEITURA MUNICIPAL DE IRANDUBA;04628533000173;PRACA DOS TRIES PODERES;33;;CENTRO;IRANDUBA;69415000;AM
PREFEITURA MUNICIPAL DE ITACOATIARA;PREFEITURA MUNICIPAL DE ITACOATIARA;04241980000175;RUA DR LUZARDO FERREIRA DE MELO;2223;;CENTRO;ITACOATIARA;69100075;AM
PREFEITURA MUNICIPAL DE ITAMARATI;PREFEITURA MUNICIPAL DE ITAMARATI;04628376000104;RUA BOA VISTA;200;;CENTRO;ITAMARATI;69510000;AM
PREFEITURA MUNICIPAL DE ITAPIRANGA;PREFEITURA MUNICIPAL DE ITAPIRANGA;04495644000159;AVPRESIDENTE GERTULIO VARGAS;159;;CENTRO;ITAPIRANGA;69120000;AM
PREFEITURA MUNICIPAL DE JAPURA;PREFEITURA MUNICIPAL DE JAPURA;04505509000147;AVENIDA AMACIO BARBOSA;S/N;;CENTRO;JAPURA;69495000;AM
PREFEITURA MUNICIPAL DE JURUA;PREFEITURA MUNICIPAL DE JURUA;04588596000143;RUA FRANCISCO DE PAULA;98;;CENTRO;JURUA;69520000;AM
PREFEITURA MUNICIPAL DE JUTAI;PREFEITURA MUNICIPAL DE JUTAI;04285896000153;ESTRADA DO ICAPO;SN;;SANTO ANTONIO;JUTAI;69660000;AM
PREFEITURA MUNICIPAL DE LABREA;PREFEITURA MUNICIPAL DE LABREA;05830872000109;RUA VILLE ROY;2051;;CENTRO;LABREA;69830000;AM
PREFEITURA MUNICIPAL DE MANACAPURU;PREFEITURA MUNICIPAL DE MANACAPURU;04274064000131;PRACA 16 DE JULHO;1001;PREDIO;CENTRO;MANACAPURU;69400905;AM
PREFEITURA MUNICIPAL DE MANAQUIRI;PREFEITURA MUNICIPAL DE MANAQUIRI;04641551000195;RUA FRANCISCO JACOB;220;;LARANJEIRAS;MANAQUIRI;69435000;AM
PREFEITURA MUNICIPAL DE MANAUS;PREFEITURA MUNICIPAL DE MANAUS;04365326000173;AVENIDA BRASIL;2977;;COMPENSA 1;MANAUS;69036110;AM
PREFEITURA MUNICIPAL DE MANICORE;PREFEITURA MUNICIPAL DE MANICORE;04197166000109;AV GETULIO VARGAS;S/N;;CENTRO;MANICORE;69280000;AM
PREFEITURA MUNICIPAL DE MARAA;PREFEITURA MUNICIPAL DE MARAA;04505640000104;AV CASTELO BRANCO;110;;CENTRO;MARAA;69490000;AM
PREFEITURA MUNICIPAL DE MAUES;PREFEITURA MUNICIPAL DE MAUES;04282869000127;R QUINTINO BOCAIUVA;248;;CENTRO;MAUES;69190000;AM
PREFEITURA MUNICIPAL DE NHAMUNDA;PREFEITURA MUNICIPAL DE NHAMUNDA;04283578000153;AV JONATHAS PEDROSA;320;;CENTRO;NHAMUNDA;69140000;AM
PREFEITURA MUNICIPAL DE NOVA OLINDA DO NORTE;PREFEITURA MUNICIPAL DE NOVA OLINDA DO NORTE;04477600000104;RUA TRIUFO;711;;CENTRO;NOVA OLINDA DO NORTE;69230000;AM
PREFEITURA MUNICIPAL DE NOVO AIRAO;PREFEITURA MUNICIPAL DE NOVO AIRAO;04533113000103;AVENIDA TIRADENTES;S/N;;CENTRO;NOVO AIRAO;69730000;AM
PREFEITURA MUNICIPAL DE NOVO ARIPUANA;PREFEITURA MUNICIPAL DE NOVO ARIPUANA;04278818000121;AV. 16 DE FEVEREIRO;S/N;PREDIO;CENTRO;NOVO ARIPUANA;69260000;AM
PREFEITURA MUNICIPAL DE PARINTINS;PREFEITURA MUNICIPAL DE PARINTINS;04329736000169;PRACA EDUARDO RIBEIRO;2052;;CENTRO;PARINTINS;69151970;AM
PREFEITURA MUNICIPAL DE PAUINI;PREFEITURA MUNICIPAL DE PAUINI;04530135000110;R 19 DE MARCO;S/N;;CIDADE ALTA;PAUINI;69860000;AM
PREFEITURA MUNICIPAL DE PRESIDENTE FIGUEIREDO;PREFEITURA MUNICIPAL DE PRESIDENTE FIGUEIREDO;04628681000198;RODOVIA BR 174;S/N;KM 107;CENTRO;PRESIDENTE FIGUEIREDO;69735000;AM
PREFEITURA MUNICIPAL DE RIO PRETO DA EVA;PREFEITURA MUNICIPAL DE RIO PRETO DA EVA;04629697000115;RUA GOVERNADOR GREGORIO AZEVEDO;18;;CENTRO;RIO PRETO DA EVA;69117000;AM
PREFEITURA MUNICIPAL DE SANTA ISABEL DO RIO NEGRO;PREFEITURA MUNICIPAL DE SANTA ISABEL DO RIO NEGRO;04194239000109;Av. Danilo Correia;S/N;;Centro;SANTA ISABEL DO RIO NEGRO;69740000;AM
PREFEITURA MUNICIPAL DE SANTO ANTONIO DO ICA;PREFEITURA MUNICIPAL DE SANTO ANTONIO DO ICA;04532057000192;RUA ALVARO MAIA;S/N;;SANTA ETELVINA;SANTO ANTONIO DO ICA;69680000;AM
PREFEITURA MUNICIPAL DE SAO GABRIEL DA CACHOEIRA;PREFEITURA MUNICIPAL DE SAO GABRIEL DA CACHOEIRA;04272670000118;AV ALVARO MAIA;569;;CENTRO;SAO GABRIEL DA CACHOEIRA;69750000;AM
PREFEITURA MUNICIPAL DE SAO PAULO DE OLIVENCA;PREFEITURA MUNICIPAL DE SAO PAULO DE OLIVENCA;05829577000124;AVENIDA BRANCO;S/N;;CENTRO;SAO PAULO DE OLIVENCA;69600000;AM
PREFEITURA MUNICIPAL DE SAO SEBASTIAO DO UATUMA;PREFEITURA MUNICIPAL DE SAO SEBASTIAO DO UATUMA;04628418000107;RUA JUSTINO DE MELO;S/N;;CENTRO;SAO SEBASTIAO DO UATUMA;69135000;AM
PREFEITURA MUNICIPAL DE SILVES;PREFEITURA MUNICIPAL DE SILVES;04477634000190;RUA CASTELO BRANCO;18;PREDIO;CENTRO;SILVES;69114000;AM
PREFEITURA MUNICIPAL DE TABATINGA;PREFEITURA MUNICIPAL DE TABATINGA;04011805000191;RUA DA PATRIA;150;;CENTRO;TABATINGA;69640000;AM
PREFEITURA MUNICIPAL DE TAPAUA;PREFEITURA MUNICIPAL DE TAPAUA;04530390000162;AV PRESIDENTE CASTELO BRANCO;S/N;;CENTRO;TAPAUA;69480000;AM
PREFEITURA MUNICIPAL DE TEFE;PREFEITURA MUNICIPAL DE TEFE;04426383000115;R MONTEIRO LOBATO;26;;CENTRO;TEFE;69550902;AM
PREFEITURA MUNICIPAL DE TONANTINS;PREFEITURA MUNICIPAL DE TONANTINS;04628608000116;LEOPOLDO PERES;SN;;CENTRO;TONANTINS;69685000;AM
PREFEITURA MUNICIPAL DE UARINI;PREFEITURA MUNICIPAL DE UARINI;04647079000106;RUA PRUDENTE DE MORAES;330;;CENTRO;UARINI;69530000;AM
PREFEITURA MUNICIPAL DE URUCARA;PREFEITURA MUNICIPAL DE URUCARA;04477782000105;RUA CRISPIM LOBO;111;;SAO JOSE;URUCARA;69130000;AM
PREFEITURA MUNICIPAL DE URUCURITUBA;PREFEITURA MUNICIPAL DE URUCURITUBA;04502571000185;AV PRESIDENTE CASTELO BRANCO;44;;CENTRO;URUCURITUBA;69180000;AM
PREFEITURA MUNICIPAL DE ABAIARA;PREFEITURA MUNICIPAL DE ABAIARA;07411531000116;RUA ESPEDITO OLIVEIRA DAS NEVES;S/N;;CENTRO;ABAIARA;63240000;CE
PREFEITURA MUNICIPAL DE ACARAPE;PREFEITURA MUNICIPAL DE ACARAPE;23555170000138;AV HENRIQUE BESSA;S/N;;CENTRO;ACARAPE;62785000;CE
PREFEITURA MUNICIPAL DE ACARAU;PREFEITURA MUNICIPAL DE ACARAU;07547821000191;RUA SANTO ANTONIO;01194;;CENTRO;ACARAU;62580000;CE
PREFEITURA MUNICIPAL DE ACOPIARA;PREFEITURA MUNICIPAL DE ACOPIARA;07847379000119;RUA CAZUZINHA MARQUES;S/N;;CENTRO;ACOPIARA;63560000;CE
PREFEITURA MUNICIPAL DE AIUABA;PREFEITURA MUNICIPAL DE AIUABA;07568231000145;RUA NICEAS ARRAES;00128;;CENTRO;AIUABA;63575000;CE
PREFEITURA MUNICIPAL DE ALCANTARAS;PREFEITURA MUNICIPAL DE ALCANTARAS;07598626000190;RUA JOAO CAETANO;S/N;;CENTRO;ALCANTARAS;62120000;CE
PREFEITURA MUNICIPAL DE ALTANEIRA;PREFEITURA MUNICIPAL DE ALTANEIRA;07385503000171;RUA FURTADO LEITE;272;;CENTRO;ALTANEIRA;63195000;CE
PREFEITURA MUNICIPAL DE ALTO SANTO;PREFEITURA MUNICIPAL DE ALTO SANTO;07891666000126;RUA CEL S BEZERRA;00198;;CENTRO;ALTO SANTO;62970000;CE
PREFEITURA MUNICIPAL DE AMONTADA;PREFEITURA MUNICIPAL DE AMONTADA;06582449000191;PRACA CEL ANTONIO BELO;00606;;CENTRO;AMONTADA;62540000;CE
PREFEITURA MUNICIPAL DE APUIARES;PREFEITURA MUNICIPAL DE APUIARES;07438468000101;AV. GOMES DA SILVA;99;;CENTRO;APUIARES;62630000;CE
PREFEITURA MUNICIPAL DE AQUIRAZ;PREFEITURA MUNICIPAL DE AQUIRAZ;07911696000157;RUA JOAO PAULO II;00096;;CENTRO;AQUIRAZ;61700000;CE
PREFEITURA MUNICIPAL DE ARACATI;PREFEITURA MUNICIPAL DE ARACATI;07684756000146;RUA SANTOS DUMONT;S/N;;CENTRO;ARACATI;62800000;CE
PREFEITURA MUNICIPAL DE ARACOIABA;PREFEITURA MUNICIPAL DE ARACOIABA;07387392000132;AV INDEPENDECIA;S/N;;CENTRO;ARACOIABA;62750000;CE
PREFEITURA MUNICIPAL DE ARARENDA;PREFEITURA MUNICIPAL DE ARARENDA;23718356000160;RUA CENTRAL;SN;;CENTRO;ARARENDA;62213000;CE
PREFEITURA MUNICIPAL DE ARARIPE;PREFEITURA MUNICIPAL DE ARARIPE;07539984000122;ARARIPE;S/N;;CENTRO;ARARIPE;63170000;CE
PREFEITURA MUNICIPAL DE ARATUBA;PREFEITURA MUNICIPAL DE ARATUBA;07387525000170;RUA JULIO PEREIRA;731;;CENTRO;ARATUBA;62762000;CE
PREFEITURA MUNICIPAL DE ARNEIROZ;PREFEITURA MUNICIPAL DE ARNEIROZ;06748297000154;RUA LEONARDO FEITOSA;00077;;CENTRO;ARNEIROZ;63670000;CE
PREFEITURA MUNICIPAL DE ASSARE;PREFEITURA MUNICIPAL DE ASSARE;07587983000153;RUA DR GENTIL BRAGA;00042;;CENTRO;ASSARE;63140000;CE
PREFEITURA MUNICIPAL DE AURORA;PREFEITURA MUNICIPAL DE AURORA;07978042000140;AVENIDA ANTONIO RICARDO;00043;;CENTRO;AURORA;63360000;CE
PREFEITURA MUNICIPAL DE BAIXIO;PREFEITURA MUNICIPAL DE BAIXIO;07520224000173;PRACA DA MATRIZ;S/N;;CENTRO;BAIXIO;63320000;CE
PREFEITURA MUNICIPAL DE BANABUIU;PREFEITURA MUNICIPAL DE BANABUIU;23444672000191;RUA DEMOCRITO PINTO;S/N;;CENTRO;BANABUIU;63960000;CE
PREFEITURA MUNICIPAL DE BARBALHA;PREFEITURA MUNICIPAL DE BARBALHA;06740278000181;RUA PRINCESA ISABEL;118;;CENTRO;BARBALHA;63180000;CE
PREFEITURA MUNICIPAL DE BARREIRA;PREFEITURA MUNICIPAL DE BARREIRA;12459632000105;RUA MARIA OLIVEIRA;00260;;CENTRO;BARREIRA;62795000;CE
PREFEITURA MUNICIPAL DE BARRO;PREFEITURA MUNICIPAL DE BARRO;07620396000119;RUA JOSE DIAS CABRAL;S/N;;CENTRO;BARRO;63380000;CE
PREFEITURA MUNICIPAL DE BARROQUINHA;PREFEITURA MUNICIPAL DE BARROQUINHA;23478597000180;RUA BOA ESPERANCA;00095;;CENTRO;BARROQUINHA;62410000;CE
PREFEITURA MUNICIPAL DE BATURITE;PREFEITURA MUNICIPAL DE BATURITE;07387343000108;RUA N SENHORA PALMA;S/N;;CENTRO;BATURITE;62760000;CE
PREFEITURA MUNICIPAL DE BEBERIBE;PREFEITURA MUNICIPAL DE BEBERIBE;07528292000189;RUA JOAO TOMAZ FERREIRA;00001;;CENTRO;BEBERIBE;62840000;CE
PREFEITURA MUNICIPAL DE BELA CRUZ;PREFEITURA MUNICIPAL DE BELA CRUZ;07566045000177;RUA SETE DE SETEMBRO;00034;;CENTRO;BELA CRUZ;62570000;CE
PREFEITURA MUNICIPAL DE BOA VIAGEM;PREFEITURA MUNICIPAL DE BOA VIAGEM;07963515000136;PRACA MONS JOSE CANDIDO;00100;;CENTRO;BOA VIAGEM;63870000;CE
PREFEITURA MUNICIPAL DE BREJO SANTO;PREFEITURA MUNICIPAL DE BREJO SANTO;07620701000172;RUA JOSE MATIAS SAMPAIO;365;;CENTRO;BREJO SANTO;63260000;CE
PREFEITURA MUNICIPAL DE CAMOCIM;PREFEITURA MUNICIPAL DE CAMOCIM;07660350000123;PCA JOSE SEVERIANO MOREL;SN;;CENTRO;CAMOCIM;62400000;CE
PREFEITURA MUNICIPAL DE CAMPOS SALES;PREFEITURA MUNICIPAL DE CAMPOS SALES;07416704000199;TRAVESSA SUL;00440;;CENTRO;CAMPOS SALES;63150000;CE
PREFEITURA MUNICIPAL DE CANINDE;PREFEITURA MUNICIPAL DE CANINDE;07963259000187;LARGO FRANCISCO XAVIER DE MEDEIROS;1123;;IMACULADA CONCEICAO;CANINDE;62700000;CE
PREFEITURA MUNICIPAL DE CAPISTRANO;PREFEITURA MUNICIPAL DE CAPISTRANO;07063589000116;PRACA MAJOR JOSE ESTELITA DE AGUIAR;S/N;;CENTRO;CAPISTRANO;62748000;CE
PREFEITURA MUNICIPAL DE CARIDADE;PREFEITURA MUNICIPAL DE CARIDADE;07707094000182;AV CORONEL FRANCISCO LINHARES;00250;;CENTRO;CARIDADE;62730000;CE
PREFEITURA MUNICIPAL DE CARIRE;PREFEITURA MUNICIPAL DE CARIRE;07598600000142;PRACA ELISIO AGUIAR;SN;;CENTRO;CARIRE;62184000;CE
PREFEITURA MUNICIPAL DE CARIRIACU;PREFEITURA MUNICIPAL DE CARIRIACU;06738132000100;PARQUE RECREIO PARAISO;S/N;;PARAISO;CARIRIACU;63220000;CE
PREFEITURA MUNICIPAL DE CARIUS;PREFEITURA MUNICIPAL DE CARIUS;07540180000143;PRACA DA REPUBLICA;00009;;CENTRO;CARIUS;63530000;CE
PREFEITURA MUNICIPAL DE CARNAUBAL;PREFEITURA MUNICIPAL DE CARNAUBAL;07732670000141;AVENIDA PAULO SARASATE;S/N;;CENTRO;CARNAUBAL;62375000;CE
PREFEITURA MUNICIPAL DE CASCAVEL;PREFEITURA MUNICIPAL DE CASCAVEL;07589369000120;AVENIDA CHANCELER EDSON QUEIROZ;2650;;RIO NOVO;CASCAVEL;62850000;CE
PREFEITURA MUNICIPAL DE CATARINA;PREFEITURA MUNICIPAL DE CATARINA;07540925000174;RUA JOSE RODRIGUES PEREIRA NETO;00280;;TRES PODERES;CATARINA;63595000;CE
PREFEITURA MUNICIPAL DE CATUNDA;PREFEITURA MUNICIPAL DE CATUNDA;35049097000101;PRACA DA MATRIZ;S/N;;CENTRO;CATUNDA;62297000;CE
PREFEITURA MUNICIPAL DE CAUCAIA;PREFEITURA MUNICIPAL DE CAUCAIA;07616162000106;RUA CEL CORREIA;1959;ALTOS;CENTRO;CAUCAIA;61600004;CE
PREFEITURA MUNICIPAL DE CEDRO;PREFEITURA MUNICIPAL DE CEDRO;07812241000184;RUA CEL LUIZ FELIPE;229;;CENTRO;CEDRO;63400000;CE
PREFEITURA MUNICIPAL DE CHAVAL;PREFEITURA MUNICIPAL DE CHAVAL;07146301000177;PCA DA MATRIZ;S/N;;CENTRO;CHAVAL;62420000;CE
PREFEITURA MUNICIPAL DE CHORO;PREFEITURA MUNICIPAL DE CHORO;63386627000142;RUA JOSE EDNILSON MATOS PINTO;488;;CENTRO;CHORO;63950000;CE
PREFEITURA MUNICIPAL DE CHOROZINHO;PREFEITURA MUNICIPAL DE CHOROZINHO;23555279000175;AVENIDA RAIMUNDO SIMPLICIO DE CARVALHO;S/N;;VILA REQUEIJAO;CHOROZINHO;62875000;CE
PREFEITURA MUNICIPAL DE COREAU;PREFEITURA MUNICIPAL DE COREAU;07598618000144;AV. DOM JOSE;55;;CENTRO;COREAU;62160000;CE
PREFEITURA MUNICIPAL DE CRATEUS;PREFEITURA MUNICIPAL DE CRATEUS;07982036000167;RUA CORONEL ZEZE;1141;;CENTRO;CRATEUS;63700970;CE
PREFEITURA MUNICIPAL DE CRATO;PREFEITURA MUNICIPAL DE CRATO;07587975000107;SENADOR POMPEU;216;;CENTRO;CRATO;63100080;CE
PREFEITURA MUNICIPAL DE CROATA;PREFEITURA MUNICIPAL DE CROATA;10462349000107;RUA MANUEL BRAGA;573;;CAROBA;CROATA;62390000;CE
PREFEITURA MUNICIPAL DE CRUZ;PREFEITURA MUNICIPAL DE CRUZ;07663917000115;PRACA DOS TRES PODERES;S/N;;ANINGAS;CRUZ;62595000;CE
PREFEITURA MUNICIPAL DE DEPUTADO IRAPUAN PINHEIRO;PREFEITURA MUNICIPAL DE DEPUTADO IRAPUAN PINHEIRO;12464103000191;RUA JOSE JOSUE DA COSTA;S/N;;CENTRO;DEPUTADO IRAPUAN PINHEIRO;63645000;CE
PREFEITURA MUNICIPAL DE ERERE;PREFEITURA MUNICIPAL DE ERERE;12465068000125;RUA PADRE MIGUEL XAVIER DE MORAIS;20;;CENTRO;ERERE;63470000;CE
PREFEITURA MUNICIPAL DE EUSEBIO;PREFEITURA MUNICIPAL DE EUSEBIO;23563067000130;RUA EDMILSON PINHEIRO;150;;AUTODROMO;EUSEBIO;61764010;CE
PREFEITURA MUNICIPAL DE FARIAS BRITO;PREFEITURA MUNICIPAL DE FARIAS BRITO;07595572000100;RUA JOSÉ ALVES PIMENTEL;S/N;;CENTRO;FARIAS BRITO;63185000;CE
PREFEITURA MUNICIPAL DE FORQUILHA;PREFEITURA MUNICIPAL DE FORQUILHA;07673106000103;RUA DANTE VALERIO;S/N;;CENTRO;FORQUILHA;62115000;CE
PREFEITURA MUNICIPAL DE FORTALEZA;PREFEITURA MUNICIPAL DE FORTALEZA;07954605000160;R GENERAL BEZERRIL;755;;CENTRO;FORTALEZA;60115190;CE
PREFEITURA MUNICIPAL DE FORTIM;PREFEITURA MUNICIPAL DE FORTIM;35050756000120;RUA NOSSA SENHORA DO AMPARO;462;;CENTRO;FORTIM;62817000;CE
PREFEITURA MUNICIPAL DE FRECHEIRINHA;PREFEITURA MUNICIPAL DE FRECHEIRINHA;07598592000134;R CAP JOAQUIM FRANCISCO;S/N;;CENTRO;FRECHEIRINHA;62340000;CE
PREFEITURA MUNICIPAL DE GENERAL SAMPAIO;PREFEITURA MUNICIPAL DE GENERAL SAMPAIO;07438591000122;RUA JOSE SEVERINO FILHO;S/N;;CENTRO;GENERAL SAMPAIO;62738000;CE
PREFEITURA MUNICIPAL DE GRACA;PREFEITURA MUNICIPAL DE GRACA;23467889000117;AV JOSE CANDIDO CARVALHO;00483;;CENTRO;GRACA;62365000;CE
PREFEITURA MUNICIPAL DE GRANJA;PREFEITURA MUNICIPAL DE GRANJA;07827165000180;PRACA DA MATRIZ;S/N;;CENTRO;GRANJA;62430000;CE
PREFEITURA MUNICIPAL DE GRANJEIRO;PREFEITURA MUNICIPAL DE GRANJEIRO;41342098000142;RUA DAVID GRANGEIRO;00104;RUA;CENTRO;GRANJEIRO;63230000;CE
PREFEITURA MUNICIPAL DE GROAIRAS;PREFEITURA MUNICIPAL DE GROAIRAS;07598709000180;RUA VEREADOR MARC OLAVO;770;;CENTRO;GROAIRAS;62190000;CE
PREFEITURA MUNICIPAL DE GUAIUBA;PREFEITURA MUNICIPAL DE GUAIUBA;12359535000132;RUA RODOLFO TEOFILO;00090;;CENTRO;GUAIUBA;61890000;CE
PREFEITURA MUNICIPAL DE GUARACIABA DO NORTE;PREFEITURA MUNICIPAL DE GUARACIABA DO NORTE;07569205000131;AVENIDA MONSENHOR FURTADO;64;;CENTRO;GUARACIABA DO NORTE;62380000;CE
PREFEITURA MUNICIPAL DE GUARAMIRANGA;PREFEITURA MUNICIPAL DE GUARAMIRANGA;07606478000109;RUA JOAQUIM ALVES NOGUEIRA;409;;CENTRO;GUARAMIRANGA;62766000;CE
PREFEITURA MUNICIPAL DE HIDROLANDIA;PREFEITURA MUNICIPAL DE HIDROLANDIA;07707680000127;RUA PRESIDENTE KENNEDY;00640;;CENTRO;HIDROLANDIA;62270000;CE
PREFEITURA MUNICIPAL DE HORIZONTE;PREFEITURA MUNICIPAL DE HORIZONTE;23555196000186;AV JUVENAL DE CASTRO;435;SECRETARIA DE SAUDE ;CENTRO;HORIZONTE;62880162;CE
PREFEITURA MUNICIPAL DE IBARETAMA;PREFEITURA MUNICIPAL DE IBARETAMA;23444680000138;RUA JOAO DE ALMEIDA;S/N;;CENTRO;IBARETAMA;63970000;CE
PREFEITURA MUNICIPAL DE IBIAPINA;PREFEITURA MUNICIPAL DE IBIAPINA;07523186000102;AVENIDA DEP FERNAN MELO;S/N;;CENTRO;IBIAPINA;62360000;CE
PREFEITURA MUNICIPAL DE IBICUITINGA;PREFEITURA MUNICIPAL DE IBICUITINGA;12461646000155;RUA JOSE DAMASCENO;1783;;CENTRO;IBICUITINGA;62955000;CE
PREFEITURA MUNICIPAL DE ICAPUI;PREFEITURA MUNICIPAL DE ICAPUI;10393593000157;PRACA ADAUTO ROSEO;1229;;CENTRO;ICAPUI;62810000;CE
PREFEITURA MUNICIPAL DE ICO;PREFEITURA MUNICIPAL DE ICO;07669682000179;ICO;S/N;;CENTRO;ICO;63430000;CE
PREFEITURA MUNICIPAL DE IGUATU;PREFEITURA MUNICIPAL DE IGUATU;07810468000190;RUA RUI BARBOSA;S/N;;SAO SEBASTIAO;IGUATU;63500255;CE
PREFEITURA MUNICIPAL DE INDEPENDENCIA;PREFEITURA MUNICIPAL DE INDEPENDENCIA;07982028000110;RUA DO CRUZEIRO;00498;;CENTRO;INDEPENDENCIA;63640000;CE
PREFEITURA MUNICIPAL DE IPAPORANGA;PREFEITURA MUNICIPAL DE IPAPORANGA;10462364000147;JOAO LUCIANO;555;;CENTRO;IPAPORANGA;62215000;CE
PREFEITURA MUNICIPAL DE IPAUMIRIM;PREFEITURA MUNICIPAL DE IPAUMIRIM;07520141000184;TRAV JOAQUIM PIRES;SN;;CENTRO;IPAUMIRIM;63340000;CE
PREFEITURA MUNICIPAL DE IPU;PREFEITURA MUNICIPAL DE IPU;07679723000108;PRACA DA MATRIZ;SN;;CENTRO;IPU;62250000;CE
PREFEITURA MUNICIPAL DE IPUEIRAS;PREFEITURA MUNICIPAL DE IPUEIRAS;07680846000169;RUA PADRE ANGELIM;00120;;CENTRO;IPUEIRAS;62230000;CE
PREFEITURA MUNICIPAL DE IRACEMA;PREFEITURA MUNICIPAL DE IRACEMA;12461653000157;RUA RAIMUNDO B DE MELO;38;;CENTRO;IRACEMA;62980000;CE
PREFEITURA MUNICIPAL DE IRAUCUBA;PREFEITURA MUNICIPAL DE IRAUCUBA;07683188000169;AV PAULO BASTOS;S/N;;CENTRO;IRAUCUBA;62620000;CE
PREFEITURA MUNICIPAL DE ITAICABA;PREFEITURA MUNICIPAL DE ITAICABA;07403769000108;CEL JOAO BATISTA;00236;;CENTRO;ITAICABA;62820000;CE
PREFEITURA MUNICIPAL DE ITAITINGA;PREFEITURA MUNICIPAL DE ITAITINGA;41563628000182;CORONEL VIRGILIO TAVORA;SN;;CENTRO;ITAITINGA;61880000;CE
PREFEITURA MUNICIPAL DE ITAPAGE;PREFEITURA MUNICIPAL DE ITAPAGE;07683956000184;RUA MAJ J ALEXANDRE;00140;;CENTRO;ITAPAGE;62600000;CE
PREFEITURA MUNICIPAL DE ITAPIPOCA;PREFEITURA MUNICIPAL DE ITAPIPOCA;07623077000167;RUA INOCENCIO BRAGA;00301;;CENTRO;ITAPIPOCA;62500007;CE
PREFEITURA MUNICIPAL DE ITAPIUNA;PREFEITURA MUNICIPAL DE ITAPIUNA;07387509000188;AVENIDA SAO CRISTOVAO;215;SEDE;CENTRO;ITAPIUNA;62740000;CE
PREFEITURA MUNICIPAL DE ITAREMA;PREFEITURA MUNICIPAL DE ITAREMA;07663941000154;PRACA DA MATRIZ;S/N;;CENTRO;ITAREMA;62590000;CE
PREFEITURA MUNICIPAL DE ITATIRA;PREFEITURA MUNICIPAL DE ITATIRA;07963739000148;RUA JOSE LAURINDO;00054;;CENTRO;ITATIRA;62720000;CE
PREFEITURA MUNICIPAL DE JAGUARETAMA;PREFEITURA MUNICIPAL DE JAGUARETAMA;07442825000105;AVENIDA TRISTAO GONCALVES;185;;CENTRO;JAGUARETAMA;63480000;CE
PREFEITURA MUNICIPAL DE JAGUARIBARA;PREFEITURA MUNICIPAL DE JAGUARIBARA;07442981000176;JAGUARIBARA;S/N;;CENTRO;JAGUARIBARA;63490000;CE
PREFEITURA MUNICIPAL DE JAGUARIBE;PREFEITURA MUNICIPAL DE JAGUARIBE;07443708000166;PRACA SENADOR FERNANDES TAVORA;SN;;CENTRO;JAGUARIBE;63475000;CE
PREFEITURA MUNICIPAL DE JAGUARUANA;PREFEITURA MUNICIPAL DE JAGUARUANA;07615750000117;PRACA ADOLFO FRANCISCO DA ROCHA;404;;CENTRO;JAGUARUANA;62823000;CE
PREFEITURA MUNICIPAL DE JATI;PREFEITURA MUNICIPAL DE JATI;07413255000125;RUA SABINO PEREIRA;00068;;CENTRO;JATI;63275000;CE
PREFEITURA MUNICIPAL DE JIJOCA DE JERICOACOARA;PREFEITURA MUNICIPAL DE JIJOCA DE JERICOACOARA;23718034000111;RUA MINAS GERAIS;481;;CENTRO;JIJOCA DE JERICOACOARA;62598000;CE
PREFEITURA MUNICIPAL DE JUAZEIRO DO NORTE;PREFEITURA MUNICIPAL DE JUAZEIRO DO NORTE;02628917000160;PRACA DIRCEU FIGUEIREDO;S/N;;CENTRO;JUAZEIRO DO NORTE;63010000;CE
PREFEITURA MUNICIPAL DE JUCAS;PREFEITURA MUNICIPAL DE JUCAS;07541279000160;PRACA CASTELO BRANCO;00001;;CENTRO;JUCAS;63580000;CE
PREFEITURA MUNICIPAL DE LAVRAS DA MANGABEIRA;PREFEITURA MUNICIPAL DE LAVRAS DA MANGABEIRA;07609621000116;RUA MONSENHOR MECENO;00078;;CENTRO;LAVRAS DA MANGABEIRA;63300000;CE
PREFEITURA MUNICIPAL DE LIMOEIRO DO NORTE;PREFEITURA MUNICIPAL DE LIMOEIRO DO NORTE;07891674000172;RUA CEL ANTONIO JOAQUIM;02121;;CENTRO;LIMOEIRO DO NORTE;62930000;CE
PREFEITURA MUNICIPAL DE MADALENA;PREFEITURA MUNICIPAL DE MADALENA;10508935000137;RUA ANTONIO COSTA VIEIRA;S/N;;CENTRO;MADALENA;63860000;CE
PREFEITURA MUNICIPAL DE MARACANAU;PREFEITURA MUNICIPAL DE MARACANAU;07605850000162;AV II;150;;JEREISSATI I;MARACANAU;61900370;CE
PREFEITURA MUNICIPAL DE MARANGUAPE;PREFEITURA MUNICIPAL DE MARANGUAPE;07963051000168;RUA MUNDICA PAULA;S/N;;CENTRO;MARANGUAPE;61940145;CE
PREFEITURA MUNICIPAL DE MARCO;PREFEITURA MUNICIPAL DE MARCO;07566516000147;PRACA DOM JOSE TUPINAMBA DA FROTA;S/N;;CENTRO;MARCO;62560000;CE
PREFEITURA MUNICIPAL DE MARTINOPOLE;PREFEITURA MUNICIPAL DE MARTINOPOLE;07661192000126;AV CAPITAO BRITO;S/N;;CENTRO;MARTINOPOLE;62450000;CE
PREFEITURA MUNICIPAL DE MASSAPE;PREFEITURA MUNICIPAL DE MASSAPE;07598691000116;RUA MAJOR JOSE PAULINO;191;;CENTRO;MASSAPE;62140000;CE
PREFEITURA MUNICIPAL DE MAURITI;PREFEITURA MUNICIPAL DE MAURITI;07655269000155;RUA HENRIQUE ALENCAR;S/N;;CENTRO;MAURITI;63210000;CE
PREFEITURA MUNICIPAL DE MERUOCA;PREFEITURA MUNICIPAL DE MERUOCA;07598683000170;AV PEDRO PEDRO SAMPAIO;385;;CENTRO;MERUOCA;62130000;CE
PREFEITURA MUNICIPAL DE MILAGRES;PREFEITURA MUNICIPAL DE MILAGRES;07655277000100;AV PRESIDENTE VARGAS;00200;;CENTRO;MILAGRES;63250000;CE
PREFEITURA MUNICIPAL DE MILHA;PREFEITURA MUNICIPAL DE MILHA;06741565000106;AV PEDRO JOSE DE OLIVEIRA;S/N;;CENTRO;MILHA;63635000;CE
PREFEITURA MUNICIPAL DE MIRAIMA;PREFEITURA MUNICIPAL DE MIRAIMA;10517563000105;ESPLANADA DA ESTACAO;00442;S/N;CENTRO;MIRAIMA;62530000;CE
PREFEITURA MUNICIPAL DE MISSAO VELHA;PREFEITURA MUNICIPAL DE MISSAO VELHA;07977044000115;RUA SANTOS DUMONT;S/N;;CENTRO;MISSAO VELHA;63200000;CE
PREFEITURA MUNICIPAL DE MOMBACA;PREFEITURA MUNICIPAL DE MOMBACA;07736390000101;RUA PADRE PEDRO LEAO;00066;;CENTRO;MOMBACA;63610000;CE
PREFEITURA MUNICIPAL DE MONSENHOR TABOSA;PREFEITURA MUNICIPAL DE MONSENHOR TABOSA;07693989000105;AV SETE DE SETEMBRO;S/N;;CENTRO;MONSENHOR TABOSA;63780000;CE
PREFEITURA MUNICIPAL DE MORADA NOVA;PREFEITURA MUNICIPAL DE MORADA NOVA;07782840000100;AVENIDA MANOEL DE CASTRO;723;;CENTRO;MORADA NOVA;62940000;CE
PREFEITURA MUNICIPAL DE MORAUJO;PREFEITURA MUNICIPAL DE MORAUJO;07598675000123;AV PREFEITO RAIMUNDO BENICIO;535;;CENTRO;MORAUJO;62480000;CE
