PREFEITURA MUNICIPAL DE CIRIACO;PREFEITURA MUNICIPAL DE CIRIACO;88202437000159;AV 19 DE MAIO;537;;CENTRO;CIRIACO;99970000;RS
PREFEITURA MUNICIPAL DE COLINAS;PREFEITURA MUNICIPAL DE COLINAS;94706140000123;OLAVO BILAC;370;;CENTRO;COLINAS;95895000;RS
PREFEITURA MUNICIPAL DE COLORADO;PREFEITURA MUNICIPAL DE COLORADO;87613527000170;AVN BOA ESPERANCA;692;;CENTRO;COLORADO;99460000;RS
PREFEITURA MUNICIPAL DE CONDOR;PREFEITURA MUNICIPAL DE CONDOR;88437926000190;CONDOR;22;;CENTRO;CONDOR;98290000;RS
PREFEITURA MUNICIPAL DE CONSTANTINA;PREFEITURA MUNICIPAL DE CONSTANTINA;87708889000144;RUA JOAO MAFESSONI;483;CASA;CENTRO;CONSTANTINA;99680000;RS
PREFEITURA MUNICIPAL DE COQUEIRO BAIXO;PREFEITURA MUNICIPAL DE COQUEIRO BAIXO;04217860000132;RUA VICENTE MANICA;70;URBANO;CENTRO;COQUEIRO BAIXO;95955000;RS
PREFEITURA MUNICIPAL DE COQUEIROS DO SUL;PREFEITURA MUNICIPAL DE COQUEIROS DO SUL;94703980000132;AV PRESIDENTE VARGAS;315;;CENTRO;COQUEIROS DO SUL;99528000;RS
PREFEITURA MUNICIPAL DE CORONEL BARROS;PREFEITURA MUNICIPAL DE CORONEL BARROS;94721388000163;TVA 20 DE MARCO;1;;CENTRO;CORONEL BARROS;98735000;RS
PREFEITURA MUNICIPAL DE CORONEL BICACO;PREFEITURA MUNICIPAL DE CORONEL BICACO;87613154000137;RUA 14 DE ABRIL;100;CASA;CENTRO;CORONEL BICACO;98580000;RS
PREFEITURA MUNICIPAL DE CORONEL PILAR;PREFEITURA MUNICIPAL DE CORONEL PILAR;04215013000139;AVENIDA 25 DE JULHO;538;;CENTRO;CORONEL PILAR;95726000;RS
PREFEITURA MUNICIPAL DE COTIPORA;PREFEITURA MUNICIPAL DE COTIPORA;90898487000164;RUA SILVEIRA MARTINS;163;;CENTRO;COTIPORA;95335000;RS
PREFEITURA MUNICIPAL DE COXILHA;PREFEITURA MUNICIPAL DE COXILHA;92411933000190;AV FIORAVANTE FRANCIOSI;68;;CENTRO;COXILHA;99145000;RS
PREFEITURA MUNICIPAL DE CRISSIUMAL;PREFEITURA MUNICIPAL DE CRISSIUMAL;87613147000135;AVN CASTELO BRANCO;424;;CENTRO;CRISSIUMAL;98640000;RS
PREFEITURA MUNICIPAL DE CRISTAL;PREFEITURA MUNICIPAL DE CRISTAL;90152240000102;RUA PELOTAS;302;;CENTRO;CRISTAL;96195000;RS
PREFEITURA MUNICIPAL DE CRISTAL DO SUL;PREFEITURA MUNICIPAL DE CRISTAL DO SUL;01610515000176;AV MARCELINO ZADINELLO;820;;CENTRO;CRISTAL DO SUL;98368000;RS
PREFEITURA MUNICIPAL DE CRUZ ALTA;PREFEITURA MUNICIPAL DE CRUZ ALTA;88775390000112;AVN GENERAL OSORIO;533;;CENTRO;CRUZ ALTA;98005150;RS
PREFEITURA MUNICIPAL DE CRUZALTENSE;PREFEITURA MUNICIPAL DE CRUZALTENSE;04213529000144;RUA GONCALO COELHO;SN;;CENTRO;CRUZALTENSE;99665000;RS
PREFEITURA MUNICIPAL DE CRUZEIRO DO SUL;PREFEITURA MUNICIPAL DE CRUZEIRO DO SUL;87297990000150;SAO GABRIEL;72;;CENTRO;CRUZEIRO DO SUL;95930000;RS
PREFEITURA MUNICIPAL DE DAVID CANABARRO;PREFEITURA MUNICIPAL DE DAVID CANABARRO;88203088000190;RUA ERNESTO RISSATO;265;;CENTRO;DAVID CANABARRO;99980000;RS
PREFEITURA MUNICIPAL DE DERRUBADAS;PREFEITURA MUNICIPAL DE DERRUBADAS;94442282000120;RUA IJUI;500;;CENTRO;DERRUBADAS;98528000;RS
PREFEITURA MUNICIPAL DE DEZESSEIS DE NOVEMBRO;PREFEITURA MUNICIPAL DE DEZESSEIS DE NOVEMBRO;91553966000101;RUA SANTO ANTONIO;1243;;CENTRO;DEZESSEIS DE NOVEMBRO;97845000;RS
PREFEITURA MUNICIPAL DE DILERMANDO DE AGUIAR;PREFEITURA MUNICIPAL DE DILERMANDO DE AGUIAR;01609404000140;AV. IBICUI;S/N;;CENTRO;DILERMANDO DE AGUIAR;97180000;RS
PREFEITURA MUNICIPAL DE DOIS IRMAOS;PREFEITURA MUNICIPAL DE DOIS IRMAOS;88254891000153;BERLIN;30;;CENTRO;DOIS IRMAOS;93950000;RS
PREFEITURA MUNICIPAL DE DOIS IRMAOS DAS MISSOES;PREFEITURA MUNICIPAL DE DOIS IRMAOS DAS MISSOES;92411115000197;RUA 20 DE SETEMBRO;SN;CASA;CENTRO;DOIS IRMAOS DAS MISSOES;98385000;RS
PREFEITURA MUNICIPAL DE DOIS LAJEADOS;PREFEITURA MUNICIPAL DE DOIS LAJEADOS;90221524000103;RUA DR AFRANIO HIDALGO LEMOS;549;;CENTRO;DOIS LAJEADOS;99220000;RS
PREFEITURA MUNICIPAL DE DOM FELICIANO;PREFEITURA MUNICIPAL DE DOM FELICIANO;88601943000110;RUA TIRADENTES;219;;CENTRO;DOM FELICIANO;96190000;RS
PREFEITURA MUNICIPAL DE DOM PEDRITO;PREFEITURA MUNICIPAL DE DOM PEDRITO;87482535000124;RUA BORGES DE MEDEIROS;S/N;CASA;CENTRO;DOM PEDRITO;96450000;RS
PREFEITURA MUNICIPAL DE DOM PEDRO DE ALCANTARA;PREFEITURA MUNICIPAL DE DOM PEDRO DE ALCANTARA;01640339000115;AVENIDA CENTRAL;89;;CENTRO;DOM PEDRO DE ALCANTARA;95568000;RS
PREFEITURA MUNICIPAL DE DONA FRANCISCA;PREFEITURA MUNICIPAL DE DONA FRANCISCA;87488938000180;RUA DO COMERCIO;619;;CENTRO;DONA FRANCISCA;97280000;RS
PREFEITURA MUNICIPAL DE DOUTOR MAURICIO CARDOSO;PREFEITURA MUNICIPAL DE DOUTOR MAURICIO CARDOSO;92465210000173;RUA MARECHAL DEODORO;967;CASA;CENTRO;DOUTOR MAURICIO CARDOSO;98925000;RS
PREFEITURA MUNICIPAL DE DOUTOR RICARDO;PREFEITURA MUNICIPAL DE DOUTOR RICARDO;01613360000121;RS 332 KM21;1111;;CENTRO;DOUTOR RICARDO;95967000;RS
PREFEITURA MUNICIPAL DE ELDORADO DO SUL;PREFEITURA MUNICIPAL DE ELDORADO DO SUL;92324706000127;ESTRADA DA ARROZEIRA;270;;CENTRO;ELDORADO DO SUL;92990000;RS
PREFEITURA MUNICIPAL DE ENCANTADO;PREFEITURA MUNICIPAL DE ENCANTADO;88349238000178;RUA MONSENHOR SCALABRINI;1047;;CENTRO;ENCANTADO;95960000;RS
PREFEITURA MUNICIPAL DE ENCRUZILHADA DO SUL;PREFEITURA MUNICIPAL DE ENCRUZILHADA DO SUL;89363642000169;AVENIDA RIO BRANCO;312;;CENTRO;ENCRUZILHADA DO SUL;96610000;RS
PREFEITURA MUNICIPAL DE ENGENHO VELHO;PREFEITURA MUNICIPAL DE ENGENHO VELHO;94704129000124;RUA ANTONIO TROMBETTA;;CASA;CENTRO;ENGENHO VELHO;99698000;RS
PREFEITURA MUNICIPAL DE ENTRE RIOS DO SUL;PREFEITURA MUNICIPAL DE ENTRE RIOS DO SUL;92453927000103;RUA DANILO LORENZI;585;;CENTRO;ENTRE RIOS DO SUL;99645000;RS
PREFEITURA MUNICIPAL DE ENTRE-IJUIS;PREFEITURA MUNICIPAL DE ENTRE-IJUIS;89971782000110;RUA FRANCISCO RICHTER;601;;CENTRO;ENTRE-IJUIS;98855000;RS
PREFEITURA MUNICIPAL DE EREBANGO;PREFEITURA MUNICIPAL DE EREBANGO;92453828000113;OLINDA WATER;137;;CENTRO;EREBANGO;99920000;RS
PREFEITURA MUNICIPAL DE ERECHIM;PREFEITURA MUNICIPAL DE ERECHIM;87613477000120;PRACA DA BANDEIRA;354;;CENTRO;ERECHIM;99700010;RS
PREFEITURA MUNICIPAL DE ERNESTINA;PREFEITURA MUNICIPAL DE ERNESTINA;92406180000124;RUA GUILHERME EDUARDO FETT;56;;CENTRO;ERNESTINA;99140000;RS
PREFEITURA MUNICIPAL DE ERVAL GRANDE;PREFEITURA MUNICIPAL DE ERVAL GRANDE;87613436000134;AV CAPITAO BATISTA GRANDO;242;;CENTRO;ERVAL GRANDE;99750000;RS
PREFEITURA MUNICIPAL DE ERVAL SECO;PREFEITURA MUNICIPAL DE ERVAL SECO;87613212000122;AV DO COMERCIO;364;CASA;CENTRO;ERVAL SECO;98390000;RS
PREFEITURA MUNICIPAL DE ESMERALDA;PREFEITURA MUNICIPAL DE ESMERALDA;88225149000110;AVN SAO JOAO;1391;;CENTRO;ESMERALDA;95380000;RS
PREFEITURA MUNICIPAL DE ESPERANCA DO SUL;PREFEITURA MUNICIPAL DE ESPERANCA DO SUL;01613464000136;AV RIO BRANCO;816;;CENTRO;ESPERANCA DO SUL;98635000;RS
PREFEITURA MUNICIPAL DE ESPUMOSO;PREFEITURA MUNICIPAL DE ESPUMOSO;87612743000109;PRACA BORGES DE MEDEIROS;S/N;;CENTRO;ESPUMOSO;99400000;RS
PREFEITURA MUNICIPAL DE ESTACAO;PREFEITURA MUNICIPAL DE ESTACAO;92406248000175;RUA FIORELLO PIAZETA;95;;CENTRO;ESTACAO;99930000;RS
PREFEITURA MUNICIPAL DE ESTANCIA VELHA;PREFEITURA MUNICIPAL DE ESTANCIA VELHA;88254883000107;RUA PRESIDENTE LUCENA;3454;;CENTRO;ESTANCIA VELHA;93600320;RS
PREFEITURA MUNICIPAL DE ESTEIO;PREFEITURA MUNICIPAL DE ESTEIO;88150495000186;RUA ENGENHEIRO HENER DE SOUZA NUNES;150;;CENTRO;ESTEIO;93260120;RS
PREFEITURA MUNICIPAL DE ESTRELA;PREFEITURA MUNICIPAL DE ESTRELA;87246120000151;RUA JULIO DE CASTILHOS;380;;CENTRO;ESTRELA;95880000;RS
PREFEITURA MUNICIPAL DE ESTRELA VELHA;PREFEITURA MUNICIPAL DE ESTRELA VELHA;01601857000120;AV LAURO BILLIG DE CASTILHOS;S/Nº;;CENTRO;ESTRELA VELHA;96990000;RS
PREFEITURA MUNICIPAL DE EUGENIO DE CASTRO;PREFEITURA MUNICIPAL DE EUGENIO DE CASTRO;89971766000127;RUA MANOEL FERNANDES;520;;CENTRO;EUGENIO DE CASTRO;98860000;RS
PREFEITURA MUNICIPAL DE FAGUNDES VARELA;PREFEITURA MUNICIPAL DE FAGUNDES VARELA;91566893000192;AVENIDA ALFREDO REALI;300;;CENTRO;FAGUNDES VARELA;95333000;RS
PREFEITURA MUNICIPAL DE FARROUPILHA;PREFEITURA MUNICIPAL DE FARROUPILHA;89848949000150;PRACA EMANCIPACAO;SN;;CENTRO;FARROUPILHA;95170416;RS
PREFEITURA MUNICIPAL DE FAXINAL DO SOTURNO;PREFEITURA MUNICIPAL DE FAXINAL DO SOTURNO;88488341000107;RUA JULIO DE CASTILHOS;609;;CENTRO;FAXINAL DO SOTURNO;97220000;RS
PREFEITURA MUNICIPAL DE FAXINALZINHO;PREFEITURA MUNICIPAL DE FAXINALZINHO;92453851000108;AV LIDO ARMANDO ULTRAMARI;1225;;CENTRO;FAXINALZINHO;99655000;RS
PREFEITURA MUNICIPAL DE FAZENDA VILANOVA;PREFEITURA MUNICIPAL DE FAZENDA VILANOVA;01607509000160;AV RIO GRANDE DO SUL;1111;;CENTRO SUL;FAZENDA VILANOVA;95875000;RS
PREFEITURA MUNICIPAL DE FELIZ;PREFEITURA MUNICIPAL DE FELIZ;87838330000139;RUA PINHEIRO MACHADO;55;;CENTRO;FELIZ;95770000;RS
PREFEITURA MUNICIPAL DE FLORES DA CUNHA;PREFEITURA MUNICIPAL DE FLORES DA CUNHA;87843819000107;RUA SAO JOSE;2500;;CENTRO;FLORES DA CUNHA;95270000;RS
PREFEITURA MUNICIPAL DE FLORIANO PEIXOTO;PREFEITURA MUNICIPAL DE FLORIANO PEIXOTO;01612289000162;RUA ALFREDO DUCKER;1129;;CENTRO;FLORIANO PEIXOTO;99910000;RS
PREFEITURA MUNICIPAL DE FONTOURA XAVIER;PREFEITURA MUNICIPAL DE FONTOURA XAVIER;87612768000102;AV 25 DE ABRIL;920;PREDIO;CENTRO;FONTOURA XAVIER;99370000;RS
PREFEITURA MUNICIPAL DE FORMIGUEIRO;PREFEITURA MUNICIPAL DE FORMIGUEIRO;97228126000150;AVN JOAO ISIDORO;222;;CENTRO;FORMIGUEIRO;97210000;RS
PREFEITURA MUNICIPAL DE FORQUETINHA;PREFEITURA MUNICIPAL DE FORQUETINHA;04214401000103;RUA PHILIPP NIED;1304;;CENTRO;FORQUETINHA;95937000;RS
PREFEITURA MUNICIPAL DE FORTALEZA DOS VALOS;PREFEITURA MUNICIPAL DE FORTALEZA DOS VALOS;89708051000186;RUA RUBERT;900;;CENTRO;FORTALEZA DOS VALOS;98125000;RS
PREFEITURA MUNICIPAL DE FREDERICO WESTPHALEN;PREFEITURA MUNICIPAL DE FREDERICO WESTPHALEN;87612917000125;RUA JOSE CANELLAS;358;PREDIO;CENTRO;FREDERICO WESTPHALEN;98400000;RS
PREFEITURA MUNICIPAL DE GARIBALDI;PREFEITURA MUNICIPAL DE GARIBALDI;88594999000195;RUA JULIO DE CASTILHOS;254;;CENTRO;GARIBALDI;95720000;RS
PREFEITURA MUNICIPAL DE GARRUCHOS;PREFEITURA MUNICIPAL DE GARRUCHOS;92891035000186;RUA RAMAO ADAO G DE SOUZA;505;;CENTRO;GARRUCHOS;97690000;RS
PREFEITURA MUNICIPAL DE GAURAMA;PREFEITURA MUNICIPAL DE GAURAMA;87613428000198;RUA JOAO AMANDIO SPERB;338;;CENTRO;GAURAMA;99830000;RS
PREFEITURA MUNICIPAL DE GENERAL CAMARA;PREFEITURA MUNICIPAL DE GENERAL CAMARA;88117726000150;JANUARIO BATISTA;531;;CENTRO;GENERAL CAMARA;95820000;RS
PREFEITURA MUNICIPAL DE GENTIL;PREFEITURA MUNICIPAL DE GENTIL;92411875000102;AVENIDA 20 DE MARCO;1178;;CENTRO;GENTIL;99160000;RS
PREFEITURA MUNICIPAL DE GETULIO VARGAS;PREFEITURA MUNICIPAL DE GETULIO VARGAS;87613410000196;AV FIRMINO GIRARDELO;85;;CENTRO;GETULIO VARGAS;99900000;RS
PREFEITURA MUNICIPAL DE GIRUA;PREFEITURA MUNICIPAL DE GIRUA;87613048000153;RUA INDEPENDENCIA;90;;CENTRO;GIRUA;98870000;RS
PREFEITURA MUNICIPAL DE GLORINHA;PREFEITURA MUNICIPAL DE GLORINHA;91338558000137;AV DR POMPILIO GOMES SOBRINHO;23400;;CENTRO;GLORINHA;94380000;RS
PREFEITURA MUNICIPAL DE GRAMADO;PREFEITURA MUNICIPAL DE GRAMADO;88847082000155;AVN DAS HORTENCIAS;2029;;CENTRO;GRAMADO;95670000;RS
PREFEITURA MUNICIPAL DE GRAMADO DOS LOUREIROS;PREFEITURA MUNICIPAL DE GRAMADO DOS LOUREIROS;94703964000140;AV JOSE PEDRO LOUREIRO DE MELO;;CASA;CENTRO;GRAMADO DOS LOUREIROS;99605000;RS
PREFEITURA MUNICIPAL DE GRAMADO XAVIER;PREFEITURA MUNICIPAL DE GRAMADO XAVIER;94577509000145;AVENIDA SANTA CRUZ;1142;;CENTRO;GRAMADO XAVIER;96875000;RS
PREFEITURA MUNICIPAL DE GRAVATAI;PREFEITURA MUNICIPAL DE GRAVATAI;87890992000158;AV JOSE LOUREIRO DA SILVA;1350;;CENTRO;GRAVATAI;94010001;RS
PREFEITURA MUNICIPAL DE GUABIJU;PREFEITURA MUNICIPAL DE GUABIJU;91566844000150;RUA TIRADENTES;03;;CENTRO;GUABIJU;95355000;RS
PREFEITURA MUNICIPAL DE GUAIBA;PREFEITURA MUNICIPAL DE GUAIBA;88811922000120;RUA NESTOR DE MOURA JARDIM;111;;PASSO MUNICIPAL;GUAIBA;92704300;RS
PREFEITURA MUNICIPAL DE GUAPORE;PREFEITURA MUNICIPAL DE GUAPORE;87862397000109;AVENIDA SILVIO SANSON;1135;;CENTRO;GUAPORE;99200000;RS
PREFEITURA MUNICIPAL DE GUARANI DAS MISSOES;PREFEITURA MUNICIPAL DE GUARANI DAS MISSOES;87613030000151;RUA BOA VISTA;265;;CENTRO;GUARANI DAS MISSOES;97950000;RS
PREFEITURA MUNICIPAL DE HARMONIA;PREFEITURA MUNICIPAL DE HARMONIA;91693283000150;RUA JACO WEISSHEIMER SOBRINHO;56;CASA;CENTRO;HARMONIA;95785000;RS
PREFEITURA MUNICIPAL DE HERVAL;PREFEITURA MUNICIPAL DE HERVAL;88080379000138;RUA 15 DE NOVEMBRO;680;CASA;CENTRO;HERVAL;96310000;RS
PREFEITURA MUNICIPAL DE HERVEIRAS;PREFEITURA MUNICIPAL DE HERVEIRAS;01617873000100;RUA GERMANO WINK;440;;CENTRO;HERVEIRAS;96888000;RS
PREFEITURA MUNICIPAL DE HORIZONTINA;PREFEITURA MUNICIPAL DE HORIZONTINA;87612834000136;RUA BALDUINO SCHNEIDER;375;CASA;CENTRO;HORIZONTINA;98920000;RS
PREFEITURA MUNICIPAL DE HULHA NEGRA;PREFEITURA MUNICIPAL DE HULHA NEGRA;94702784000143;AV GETULIO VARGAS;1562;CASA;CENTRO;HULHA NEGRA;96460000;RS
PREFEITURA MUNICIPAL DE HUMAITA;PREFEITURA MUNICIPAL DE HUMAITA;87613139000199;AVN JOAO PESSOA;414;CASAS;CENTRO;HUMAITA;98670000;RS
PREFEITURA MUNICIPAL DE IBARAMA;PREFEITURA MUNICIPAL DE IBARAMA;92000231000113;RUA JULIO BRIDI;723;;CENTRO;IBARAMA;96925000;RS
PREFEITURA MUNICIPAL DE IBIACA;PREFEITURA MUNICIPAL DE IBIACA;87613592000103;RUA DO INTERVENTOR;510;;CENTRO;IBIACA;99940000;RS
PREFEITURA MUNICIPAL DE IBIRAIARAS;PREFEITURA MUNICIPAL DE IBIRAIARAS;87613584000159;RUA ANTONIO FABRIS;500;;CENTRO;IBIRAIARAS;95305000;RS
PREFEITURA MUNICIPAL DE IBIRAPUITA;PREFEITURA MUNICIPAL DE IBIRAPUITA;92406263000113;RUA SCYLAS MUNIZ;394;;CENTRO;IBIRAPUITA;99320000;RS
PREFEITURA MUNICIPAL DE IBIRUBA;PREFEITURA MUNICIPAL DE IBIRUBA;87564381000110;RUA TIRADENTES;700;;CENTRO;IBIRUBA;98200000;RS
PREFEITURA MUNICIPAL DE IGREJINHA;PREFEITURA MUNICIPAL DE IGREJINHA;88379763000136;RUA DA INDEPENDENCIA;512;;CENTRO;IGREJINHA;95650000;RS
PREFEITURA MUNICIPAL DE IJUI;PREFEITURA MUNICIPAL DE IJUI;90738196000109;RUA BENJAMIN CONSTANT;429;;CENTRO;IJUI;98700000;RS
PREFEITURA MUNICIPAL DE ILOPOLIS;PREFEITURA MUNICIPAL DE ILOPOLIS;88186424000133;RUA CONSELHEIRO JOSE BOZZETTO;987;;CENTRO;ILOPOLIS;95990000;RS
PREFEITURA MUNICIPAL DE IMBE;PREFEITURA MUNICIPAL DE IMBE;90256652000184;AV SANTA ROSA;195;;CENTRO;IMBE;95625000;RS
PREFEITURA MUNICIPAL DE INDEPENDENCIA;PREFEITURA MUNICIPAL DE INDEPENDENCIA;87612826000190;RUA SENADIR PINHEIRO;1348;CASA;CENTRO;INDEPENDENCIA;98915000;RS
PREFEITURA MUNICIPAL DE INHACORA;PREFEITURA MUNICIPAL DE INHACORA;93244606000153;CENTRO;1;SN;CENTRO;INHACORA;98765000;RS
PREFEITURA MUNICIPAL DE IPE;PREFEITURA MUNICIPAL DE IPE;90544511000167;RUA FREI CASIMIRO ZAFFONATO;10;;CENTRO;IPE;95240000;RS
PREFEITURA MUNICIPAL DE IPIRANGA DO SUL;PREFEITURA MUNICIPAL DE IPIRANGA DO SUL;92453836000160;RUA DO COMERCIO;123;;CENTRO;IPIRANGA DO SUL;99925000;RS
PREFEITURA MUNICIPAL DE IRAI;PREFEITURA MUNICIPAL DE IRAI;87612941000164;RUA VALZUMIRO DUTRA;161;;CENTRO;IRAI;98460000;RS
PREFEITURA MUNICIPAL DE ITAARA;PREFEITURA MUNICIPAL DE ITAARA;01605306000134;RUA GUILHERME KURTZ;S/N;;CENTRO;ITAARA;97185000;RS
PREFEITURA MUNICIPAL DE ITACURUBI;PREFEITURA MUNICIPAL DE ITACURUBI;91573048000144;AV JOAO HERNE GEHLEN;S/N;;CENTRO;ITACURUBI;97685000;RS
PREFEITURA MUNICIPAL DE ITAPUCA;PREFEITURA MUNICIPAL DE ITAPUCA;93856862000100;RUA ARVOREZINHA;995;;CENTRO;ITAPUCA;95997000;RS
PREFEITURA MUNICIPAL DE ITAQUI;PREFEITURA MUNICIPAL DE ITAQUI;88120662000146;RUA BENTO GONCALVES;335;;CENTRO;ITAQUI;97650000;RS
PREFEITURA MUNICIPAL DE ITATI;PREFEITURA MUNICIPAL DE ITATI;04158995000174;RUA COSTA DO RIO;S/N;;CENTRO;ITATI;95538000;RS
PREFEITURA MUNICIPAL DE ITATIBA DO SUL;PREFEITURA MUNICIPAL DE ITATIBA DO SUL;87613402000140;AV AMERICA;845;;CENTRO;ITATIBA DO SUL;99760000;RS
PREFEITURA MUNICIPAL DE IVORA;PREFEITURA MUNICIPAL DE IVORA;92457175000140;RUA GARIBALDI;1098;;CENTRO;IVORA;98160000;RS
PREFEITURA MUNICIPAL DE IVOTI;PREFEITURA MUNICIPAL DE IVOTI;88254909000117;AVENIDA PRESIDENTE LUCENA;3527;;CENTRO;IVOTI;93900000;RS
PREFEITURA MUNICIPAL DE JABOTICABA;PREFEITURA MUNICIPAL DE JABOTICABA;92005560000157;RUA BROCHADO DA ROCHA;111;;CENTRO;JABOTICABA;98350000;RS
PREFEITURA MUNICIPAL DE JACUIZINHO;PREFEITURA MUNICIPAL DE JACUIZINHO;04217901000190;RUA DONA VANDA;S/N;;CENTRO;JACUIZINHO;99457000;RS
PREFEITURA MUNICIPAL DE JACUTINGA;PREFEITURA MUNICIPAL DE JACUTINGA;87613394000131;RUA SANTOS DUMONT;SN;;CENTRO;JACUTINGA;99730000;RS
PREFEITURA MUNICIPAL DE JAGUARAO;PREFEITURA MUNICIPAL DE JAGUARAO;88414552000197;RUA 15 DE NOVEMBRO;77;CASA;CENTRO;JAGUARAO;96300000;RS
PREFEITURA MUNICIPAL DE JAGUARI;PREFEITURA MUNICIPAL DE JAGUARI;87572046000163;PRACA GILSON CARLOS REGINATO;S/N;;CENTRO;JAGUARI;97760000;RS
PREFEITURA MUNICIPAL DE JAQUIRANA;PREFEITURA MUNICIPAL DE JAQUIRANA;92401561000110;RUA INACIO RODRIGUES;550;;CENTRO;JAQUIRANA;95420000;RS
PREFEITURA MUNICIPAL DE JARI;PREFEITURA MUNICIPAL DE JARI;01609402000150;RUA BARAO DO TRIUNFO;S/N;;CENTRO;JARI;98175000;RS
PREFEITURA MUNICIPAL DE JOIA;PREFEITURA MUNICIPAL DE JOIA;89650121000192;RUA BRASILINA TERRA;;;CENTRO;JOIA;98180000;RS
PREFEITURA MUNICIPAL DE JULIO DE CASTILHOS;PREFEITURA MUNICIPAL DE JULIO DE CASTILHOS;88227756000119;AVENIDA PINHEIRO MACHADO;649;;CENTRO;JULIO DE CASTILHOS;98130000;RS
PREFEITURA MUNICIPAL DE LAGOA BONITA DO SUL;PREFEITURA MUNICIPAL DE LAGOA BONITA DO SUL;04215918000109;RUA JOSE LUCHESE;3311;;CENTRO;LAGOA BONITA DO SUL;96920000;RS
PREFEITURA MUNICIPAL DE LAGOA DOS TRES CANTOS;PREFEITURA MUNICIPAL DE LAGOA DOS TRES CANTOS;94704277000149;RUA OTTO RADIKE;627;;CENTRO;LAGOA DOS TRES CANTOS;99495000;RS
PREFEITURA MUNICIPAL DE LAGOA VERMELHA;PREFEITURA MUNICIPAL DE LAGOA VERMELHA;87613626000151;AV AFONSO PENA;14;;CENTRO;LAGOA VERMELHA;95300000;RS
PREFEITURA MUNICIPAL DE LAGOAO;PREFEITURA MUNICIPAL DE LAGOAO;92406289000161;AV MANOEL DE OLIVEIRA BRITO;80;;CENTRO;LAGOAO;99340000;RS
PREFEITURA MUNICIPAL DE LAJEADO;PREFEITURA MUNICIPAL DE LAJEADO;87297982000103;RUA CORONEL JULIO MAY;242;;CENTRO;LAJEADO;95900178;RS
PREFEITURA MUNICIPAL DE LAJEADO DO BUGRE;PREFEITURA MUNICIPAL DE LAJEADO DO BUGRE;92410448000100;RUA CLEMENTINO GRAMINHO ;SN;CASA;CENTRO;LAJEADO DO BUGRE;98320000;RS
PREFEITURA MUNICIPAL DE LAVRAS DO SUL;PREFEITURA MUNICIPAL DE LAVRAS DO SUL;88201298000149;RUA CELMEZA;373;;CENTRO;LAVRAS DO SUL;97390000;RS
PREFEITURA MUNICIPAL DE LIBERATO SALZANO;PREFEITURA MUNICIPAL DE LIBERATO SALZANO;89030639000123;RUA ARCELINO ZOTTIS;1;;CENTR0;LIBERATO SALZANO;99690000;RS
PREFEITURA MUNICIPAL DE LINDOLFO COLLOR;PREFEITURA MUNICIPAL DE LINDOLFO COLLOR;94707486000146;AV CAPIVARA;1314;;CENTRO;LINDOLFO COLLOR;93940000;RS
PREFEITURA MUNICIPAL DE LINHA NOVA;PREFEITURA MUNICIPAL DE LINHA NOVA;92123900000144;RUA HENRIQUE SPIER;10;;CENTRO;LINHA NOVA;95768000;RS
PREFEITURA MUNICIPAL DE MACAMBARA;PREFEITURA MUNICIPAL DE MACAMBARA;01610568000197;RUA OTACILIO DE ALMEIDA;686;;CENTRO;MACAMBARA;97645000;RS
PREFEITURA MUNICIPAL DE MACHADINHO;PREFEITURA MUNICIPAL DE MACHADINHO;87613576000102;RUA FREI TEOFILO;414;;CENTRO;MACHADINHO;99880000;RS
PREFEITURA MUNICIPAL DE MAMPITUBA;PREFEITURA MUNICIPAL DE MAMPITUBA;01613501000106;ESTRADA GERAL;220;PREDIO;CENTRO;MAMPITUBA;95572000;RS
PREFEITURA MUNICIPAL DE MANOEL VIANA;PREFEITURA MUNICIPAL DE MANOEL VIANA;91551762000131;VALTER JOBIM;197;;CENTRO;MANOEL VIANA;97640000;RS
PREFEITURA MUNICIPAL DE MAQUINE;PREFEITURA MUNICIPAL DE MAQUINE;94436342000100;RUA OSVALDO BASTOS;622;;CENTRO;MAQUINE;95530000;RS
PREFEITURA MUNICIPAL DE MARAU;PREFEITURA MUNICIPAL DE MARAU;87599122000124;RUA IRINEU FERLIN;355;;CENTRO;MARAU;99150000;RS
PREFEITURA MUNICIPAL DE MARCELINO RAMOS;PREFEITURA MUNICIPAL DE MARCELINO RAMOS;87613287000103;PRACA PADRE BASSO;15;;CENTRO;MARCELINO RAMOS;99800000;RS
PREFEITURA MUNICIPAL DE MARIANA PIMENTEL;PREFEITURA MUNICIPAL DE MARIANA PIMENTEL;94068418000184;RUA DR MONTAURY;SN;;CENTRO;MARIANA PIMENTEL;92900000;RS
PREFEITURA MUNICIPAL DE MARIANO MORO;PREFEITURA MUNICIPAL DE MARIANO MORO;87613386000195;RUA MIGUEL DETONI;201;;CENTRO;MARIANO MORO;99790000;RS
PREFEITURA MUNICIPAL DE MARQUES DE SOUZA;PREFEITURA MUNICIPAL DE MARQUES DE SOUZA;01607619000121;RUA GETULIO VARGAS;796;;CENTRO;MARQUES DE SOUZA;95923000;RS
PREFEITURA MUNICIPAL DE MATA;PREFEITURA MUNICIPAL DE MATA;88485412000100;RUA DO COMERCIO;495;;CENTRO;MATA;97410000;RS
PREFEITURA MUNICIPAL DE MATO CASTELHANO;PREFEITURA MUNICIPAL DE MATO CASTELHANO;92412808000102;RUA SILVA MANFROI;S/N;;CENTRO;MATO CASTELHANO;99180000;RS
PREFEITURA MUNICIPAL DE MATO LEITAO;PREFEITURA MUNICIPAL DE MATO LEITAO;94577590000163;RUA LEOPOLDO ALOISIUS HINTERHOLZ;710;;CENTRO;MATO LEITAO;95835000;RS
PREFEITURA MUNICIPAL DE MATO QUEIMADO;PREFEITURA MUNICIPAL DE MATO QUEIMADO;04204318000145;RUA MONSENHOR WOLSKI;S/Nº;;CENTRO;MATO QUEIMADO;97935000;RS
PREFEITURA MUNICIPAL DE MAXIMILIANO DE ALMEIDA;PREFEITURA MUNICIPAL DE MAXIMILIANO DE ALMEIDA;87613279000167;RUA JOSE BONIFACIO;340;;CENTRO;MAXIMILIANO DE ALMEIDA;99890000;RS
PREFEITURA MUNICIPAL DE MINAS DO LEAO;PREFEITURA MUNICIPAL DE MINAS DO LEAO;91900381000110;AV GETULIO VARGAS;2085;;CENTRO;MINAS DO LEAO;96755000;RS
PREFEITURA MUNICIPAL DE MIRAGUAI;PREFEITURA MUNICIPAL DE MIRAGUAI;87613121000197;AVENIDA IJUI;1593;CASA;CENTRO;MIRAGUAI;98540000;RS
PREFEITURA MUNICIPAL DE MONTAURI;PREFEITURA MUNICIPAL DE MONTAURI;90221565000191;VIA CADORNA;600;;CENTRO;MONTAURI;99255000;RS
PREFEITURA MUNICIPAL DE MONTE ALEGRE DOS CAMPOS;PREFEITURA MUNICIPAL DE MONTE ALEGRE DOS CAMPOS;01615314000161;AVN PEDRO ZAMBAN;1000;;CENTRO;MONTE ALEGRE DOS CAMPOS;95236000;RS
PREFEITURA MUNICIPAL DE MONTE BELO DO SUL;PREFEITURA MUNICIPAL DE MONTE BELO DO SUL;91987669000174;RUA SAGRADA FAMILIA;355;;CENTRO;MONTE BELO DO SUL;95718000;RS
PREFEITURA MUNICIPAL DE MONTENEGRO;PREFEITURA MUNICIPAL DE MONTENEGRO;90895905000160;RUA JOAO PESSOA;1363;;CENTRO;MONTENEGRO;92510045;RS
PREFEITURA MUNICIPAL DE MORMACO;PREFEITURA MUNICIPAL DE MORMACO;92451038000107;AV WILLIBALDO KOENIG;864;;CENTRO;MORMACO;99315000;RS
PREFEITURA MUNICIPAL DE MORRINHOS DO SUL;PREFEITURA MUNICIPAL DE MORRINHOS DO SUL;93317980000131;RUA JOAO FRANCISCO BECKER;9;;CENTRO;MORRINHOS DO SUL;95577000;RS
PREFEITURA MUNICIPAL DE MORRO REDONDO;PREFEITURA MUNICIPAL DE MORRO REDONDO;91558650000102;AV DOS PINHAIS;53;CASA;CENTRO;MORRO REDONDO;96150000;RS
PREFEITURA MUNICIPAL DE MORRO REUTER;PREFEITURA MUNICIPAL DE MORRO REUTER;94707627000120;BR 116 KM 217;SN;;CENTRO;MORRO REUTER;93990000;RS
PREFEITURA MUNICIPAL DE MOSTARDAS;PREFEITURA MUNICIPAL DE MOSTARDAS;88000922000140;R BENTO GONCALVES;1020;;CENTRO;MOSTARDAS;96270000;RS
PREFEITURA MUNICIPAL DE MUCUM;PREFEITURA MUNICIPAL DE MUCUM;88224712000135;BORGES DE MEDEIROS;50;;CENTRO;MUCUM;95970000;RS
PREFEITURA MUNICIPAL DE MUITOS CAPOES;PREFEITURA MUNICIPAL DE MUITOS CAPOES;01621714000180;RUA DORVAL ANTUNES PEREIRA;950;;CENTRO;MUITOS CAPOES;95230000;RS
PREFEITURA MUNICIPAL DE MULITERNO;PREFEITURA MUNICIPAL DE MULITERNO;92450998000144;RUA 20 DE MARCO;812;;CENTRO;MULITERNO;99990000;RS
PREFEITURA MUNICIPAL DE NAO-ME-TOQUE;PREFEITURA MUNICIPAL DE NAO-ME-TOQUE;87613519000123;AV. ALTO JACUÍ;840;;CENTRO;NAO-ME-TOQUE;99470000;RS
PREFEITURA MUNICIPAL DE NICOLAU VERGUEIRO;PREFEITURA MUNICIPAL DE NICOLAU VERGUEIRO;92411974000186;RUA DAS AZALEIAS;795;;CENTRO;NICOLAU VERGUEIRO;99175000;RS
PREFEITURA MUNICIPAL DE NONOAI;PREFEITURA MUNICIPAL DE NONOAI;91567974000107;RUA PE MANOEL GOMES GONZALES;509;;CENTRO;NONOAI;99600000;RS
PREFEITURA MUNICIPAL DE NOVA ALVORADA;PREFEITURA MUNICIPAL DE NOVA ALVORADA;92402502000167;AV VICENTE GUERRA;1429;;CENTRO;NOVA ALVORADA;95985000;RS
PREFEITURA MUNICIPAL DE NOVA ARACA;PREFEITURA MUNICIPAL DE NOVA ARACA;87502902000104;RUA ALEXANDRE GAZZONI;200;;CENTRO;NOVA ARACA;95350000;RS
PREFEITURA MUNICIPAL DE NOVA BASSANO;PREFEITURA MUNICIPAL DE NOVA BASSANO;87502894000104;RUA SILVA JARDIM;505;;CENTRO;NOVA BASSANO;95340000;RS
PREFEITURA MUNICIPAL DE NOVA BOA VISTA;PREFEITURA MUNICIPAL DE NOVA BOA VISTA;94704061000183;AVENIDA JACOB WAGNER SOBRINHO;939;PREDIO;CENTRO;NOVA BOA VISTA;99580000;RS
PREFEITURA MUNICIPAL DE NOVA BRESCIA;PREFEITURA MUNICIPAL DE NOVA BRESCIA;88600655000141;AV BENTO GONCALVES;1400;;CENTRO;NOVA BRESCIA;95950000;RS
PREFEITURA MUNICIPAL DE NOVA CANDELARIA;PREFEITURA MUNICIPAL DE NOVA CANDELARIA;01602258000120;RUA SAO FRANCISCO;520;CASA;CENTRO;NOVA CANDELARIA;98919000;RS
PREFEITURA MUNICIPAL DE NOVA ESPERANCA DO SUL;PREFEITURA MUNICIPAL DE NOVA ESPERANCA DO SUL;92455393000146;RUA MARQUES DE TAMANDARE;1470;;CENTRO;NOVA ESPERANCA DO SUL;97770000;RS
PREFEITURA MUNICIPAL DE NOVA HARTZ;PREFEITURA MUNICIPAL DE NOVA HARTZ;91995365000159;RUA EMILIO JOST;387;;CENTRO;NOVA HARTZ;93890000;RS
PREFEITURA MUNICIPAL DE NOVA PADUA;PREFEITURA MUNICIPAL DE NOVA PADUA;92871532000112;AVN DOS IMIGRANTES;1010;;CENTRO;NOVA PADUA;95275000;RS
PREFEITURA MUNICIPAL DE NOVA PALMA;PREFEITURA MUNICIPAL DE NOVA PALMA;88488358000156;AVN DOM ERICO FERRARI;145;;CENTRO;NOVA PALMA;97250000;RS
PREFEITURA MUNICIPAL DE NOVA PETROPOLIS;PREFEITURA MUNICIPAL DE NOVA PETROPOLIS;88572748000100;RUA 7 DE SETEMBRO;330;;CENTRO;NOVA PETROPOLIS;95150000;RS
PREFEITURA MUNICIPAL DE NOVA PRATA;PREFEITURA MUNICIPAL DE NOVA PRATA;91618439000138;AVENIDA FERNANDO LUZZATTO;158;;CENTRO;NOVA PRATA;95320000;RS
PREFEITURA MUNICIPAL DE NOVA RAMADA;PREFEITURA MUNICIPAL DE NOVA RAMADA;01611828000149;RUA DO COMERCIO;;;CENTRO;NOVA RAMADA;98758000;RS
PREFEITURA MUNICIPAL DE NOVA ROMA DO SUL;PREFEITURA MUNICIPAL DE NOVA ROMA DO SUL;91110296000159;AVENIDA JULIO DE CASTILHOS;895;CENTRO ADMINISTRATIV;CENTRO;NOVA ROMA DO SUL;95260000;RS
PREFEITURA MUNICIPAL DE NOVA SANTA RITA;PREFEITURA MUNICIPAL DE NOVA SANTA RITA;94309291000148;RUA LOURENCO ZACCARO;1449;;CENTRO;NOVA SANTA RITA;92480000;RS
PREFEITURA MUNICIPAL DE NOVO BARREIRO;PREFEITURA MUNICIPAL DE NOVO BARREIRO;92410521000135;RUA PRIMEIRO DE MAIO;15;CASA;CENTRO;NOVO BARREIRO;98338000;RS
PREFEITURA MUNICIPAL DE NOVO CABRAIS;PREFEITURA MUNICIPAL DE NOVO CABRAIS;01601856000185;AVN 28 DE DEZEMBRO;S/Nº;;CENTRO;NOVO CABRAIS;96545000;RS
PREFEITURA MUNICIPAL DE NOVO HAMBURGO;PREFEITURA MUNICIPAL DE NOVO HAMBURGO;88254875000160;RUA GUIA LOPES;4201;;RONDONIA;NOVO HAMBURGO;93548013;RS
PREFEITURA MUNICIPAL DE NOVO TIRADENTES;PREFEITURA MUNICIPAL DE NOVO TIRADENTES;92411172000176;RUA DUQUE DE CAXIAS;201;;CENTRO;NOVO TIRADENTES;98370000;RS
PREFEITURA MUNICIPAL DE NOVO XINGU;PREFEITURA MUNICIPAL DE NOVO XINGU;04207526000106;AVENIDA EMILIO KNAAK;S\N;CASA;CENTRO;NOVO XINGU;99687000;RS
PREFEITURA MUNICIPAL DE OSORIO;PREFEITURA MUNICIPAL DE OSORIO;88814181000130;AVENIDA JORGE DARIVA;1251;;CENTRO;OSORIO;95520000;RS
