PREFEITURA MUNICIPAL DE SAO FELIX DO ARAGUAIA;PREFEITURA MUNICIPAL DE SAO FELIX DO ARAGUAIA;03918869000108;AV ARAGUAIA;248;CASA;CENTRO;SAO FELIX DO ARAGUAIA;78670000;MT
PREFEITURA MUNICIPAL DE SAO JOSE DO POVO;PREFEITURA MUNICIPAL DE SAO JOSE DO POVO;32972424000104;RUA JOSE SALMEN HANZE;924;;CENTRO;SAO JOSE DO POVO;78773000;MT
PREFEITURA MUNICIPAL DE SAO JOSE DO RIO CLARO;PREFEITURA MUNICIPAL DE SAO JOSE DO RIO CLARO;15024037000127;RUA PARAIBA;355;;CENTRO;SAO JOSE DO RIO CLARO;78435000;MT
PREFEITURA MUNICIPAL DE SAO JOSE DO XINGU;PREFEITURA MUNICIPAL DE SAO JOSE DO XINGU;37465317000103;AV PIRES MAURO GOMES;41;CASA;CENTRO;SAO JOSE DO XINGU;78663000;MT
PREFEITURA MUNICIPAL DE SAO JOSE DOS QUATRO MARCOS;PREFEITURA MUNICIPAL DE SAO JOSE DOS QUATRO MARCOS;15024029000180;AV DR GUILHERME P CARDOSO;539;;CENTRO;SAO JOSE DOS QUATRO MARCOS;78285000;MT
PREFEITURA MUNICIPAL DE SAO PEDRO DA CIPA;PREFEITURA MUNICIPAL DE SAO PEDRO DA CIPA;37464948000108;AVPRESIDENTE DUTRA;S/N;;CENTRO;SAO PEDRO DA CIPA;78835000;MT
PREFEITURA MUNICIPAL DE SAPEZAL;PREFEITURA MUNICIPAL DE SAPEZAL;01614225000109;AVENIDA ANTONIO ANDRE MAGGI;1400;;CENTRO;SAPEZAL;78365000;MT
PREFEITURA MUNICIPAL DE SERRA NOVA DOURADA;PREFEITURA MUNICIPAL DE SERRA NOVA DOURADA;04204945000186;AV BRASIL;S/N;CASA;CENTRO;SERRA NOVA DOURADA;78668000;MT
PREFEITURA MUNICIPAL DE SINOP;PREFEITURA MUNICIPAL DE SINOP;15024003000132;AVN DAS EMBAUBAS;1386;PREDIO;SETOR COMERCIAL;SINOP;78550206;MT
PREFEITURA MUNICIPAL DE SORRISO;PREFEITURA MUNICIPAL DE SORRISO;03239076000162;AVENIDA TANCREDO NEVES;2525;;CENTRO;SORRISO;78890900;MT
PREFEITURA MUNICIPAL DE TABAPORA;PREFEITURA MUNICIPAL DE TABAPORA;37464997000140;AVN COMENDADOR JOSE PEDRO DIAS;64;;CENTRO;TABAPORA;78563000;MT
PREFEITURA MUNICIPAL DE TANGARA DA SERRA;PREFEITURA MUNICIPAL DE TANGARA DA SERRA;03788239000166;AV BRASIL;2351;TANGARA DA SERRA;JD EUROPA;TANGARA DA SERRA;78300174;MT
PREFEITURA MUNICIPAL DE TAPURAH;PREFEITURA MUNICIPAL DE TAPURAH;24772253000141;PRACA DA JUVENTUDE;1100;;CENTRO;TAPURAH;78573000;MT
PREFEITURA MUNICIPAL DE TERRA NOVA DO NORTE;PREFEITURA MUNICIPAL DE TERRA NOVA DO NORTE;01978212000100;AVENIDA 12 DE ABRIL;101;;CENTRO;TERRA NOVA DO NORTE;78505000;MT
PREFEITURA MUNICIPAL DE TESOURO;PREFEITURA MUNICIPAL DE TESOURO;03543303000149;RUA HUMBERTO MARCILIO;158;;CENTRO;TESOURO;78775000;MT
PREFEITURA MUNICIPAL DE TORIXOREU;PREFEITURA MUNICIPAL DE TORIXOREU;03503646000180;RUA XV DE NOVEMBRO;016;;SETOR AEROPORTO;TORIXOREU;78695000;MT
PREFEITURA MUNICIPAL DE UNIAO DO SUL;PREFEITURA MUNICIPAL DE UNIAO DO SUL;01614538000159;AV: CURITIBA;94;;CENTRO;UNIAO DO SUL;78543000;MT
PREFEITURA MUNICIPAL DE VALE DE SAO DOMINGOS;PREFEITURA MUNICIPAL DE VALE DE SAO DOMINGOS;04215993000170;AVN TANCREDO NEVES;S/N;;CENTRO;VALE DE SAO DOMINGOS;78253000;MT
PREFEITURA MUNICIPAL DE VARZEA GRANDE;PREFEITURA MUNICIPAL DE VARZEA GRANDE;03507548000110;AVENIDA CASTELO BRANCO;2500;PACO MUNICIPAL;AGUA LIMPA;VARZEA GRANDE;78125700;MT
PREFEITURA MUNICIPAL DE VERA;PREFEITURA MUNICIPAL DE VERA;00179531000193;AV. OTAWA;1651;;ESPERANCA;VERA;78880000;MT
PREFEITURA MUNICIPAL DE VILA BELA DA SANTISSIMA TRINDADE;PREFEITURA MUNICIPAL DE VILA BELA DA SANTISSIMA TRINDADE;03214160000121;RUA DR MARIO CORREA;S/N;;CENTRO;VILA BELA DA SANTISSIMA TRINDADE;78245000;MT
PREFEITURA MUNICIPAL DE VILA RICA;PREFEITURA MUNICIPAL DE VILA RICA;03238862000145;AV BRASIL;1125;CASA;CENTRO;VILA RICA;78645000;MT
PREFEITURA MUNICIPAL DE AGUA BRANCA;PREFEITURA MUNICIPAL DE AGUA BRANCA;12350153000148;RUA CORONEL ULISSES LUNA;16;;CENTRO;AGUA BRANCA;57490000;AL
PREFEITURA MUNICIPAL DE ANADIA;PREFEITURA MUNICIPAL DE ANADIA;12227351000119;RUA MONSENHOR LUIZ MARQUES;S/N;;CENTRO;ANADIA;57660000;AL
PREFEITURA MUNICIPAL DE ARAPIRACA;PREFEITURA MUNICIPAL DE ARAPIRACA;12198693000158;RUA JOSE JAILSON NUNES;S/N;;SANTA EDWIRGENS;ARAPIRACA;57310240;AL
PREFEITURA MUNICIPAL DE ATALAIA;PREFEITURA MUNICIPAL DE ATALAIA;12200143000126;TRAVESSA XI DE JUNHO;274;;CENTRO;ATALAIA;57690000;AL
PREFEITURA MUNICIPAL DE BARRA DE SANTO ANTONIO;PREFEITURA MUNICIPAL DE BARRA DE SANTO ANTONIO;12262713000102;AV PEDRO CAVALCANTE;S/N;AV PRINCIPAL DA CIDA;BARRA I;BARRA DE SANTO ANTONIO;57925000;AL
PREFEITURA MUNICIPAL DE BARRA DE SAO MIGUEL;PREFEITURA MUNICIPAL DE BARRA DE SAO MIGUEL;12263869000108;PRACA MIRIEL CAVALCANTE;S/N;;CENTRO;BARRA DE SAO MIGUEL;57180000;AL
PREFEITURA MUNICIPAL DE BATALHA;PREFEITURA MUNICIPAL DE BATALHA;12250056000183;RUA PE DANIEL BEZERRA;;;CENTRO;BATALHA;57420000;AL
PREFEITURA MUNICIPAL DE BELEM;PREFEITURA MUNICIPAL DE BELEM;12227641000162;RUA DO COMERCIO;249;;CENTRO;BELEM;57630000;AL
PREFEITURA MUNICIPAL DE BELO MONTE;PREFEITURA MUNICIPAL DE BELO MONTE;12250163000101;RUA DA MATRIZ;S/N;;CENTRO;BELO MONTE;57435000;AL
PREFEITURA MUNICIPAL DE BOCA DA MATA;PREFEITURA MUNICIPAL DE BOCA DA MATA;12264396000163;PRACA 11 DE NOVEMBRO;S/N;;CENTRO;BOCA DA MATA;57680000;AL
PREFEITURA MUNICIPAL DE BRANQUINHA;PREFEITURA MUNICIPAL DE BRANQUINHA;12332995000177;RUA PRADO OMENA;S/N;;CENTRO;BRANQUINHA;57830000;AL
PREFEITURA MUNICIPAL DE CACIMBINHAS;PREFEITURA MUNICIPAL DE CACIMBINHAS;12227971000158;AV NOSSA SENHORA DA PENHA;00059;;CENTRO;CACIMBINHAS;57570000;AL
PREFEITURA MUNICIPAL DE CAJUEIRO;PREFEITURA MUNICIPAL DE CAJUEIRO;12333738000150;AV GUADALAJARA;;;CENTRO;CAJUEIRO;57770000;AL
PREFEITURA MUNICIPAL DE CAMPESTRE;PREFEITURA MUNICIPAL DE CAMPESTRE;01631604000107;RUA DO COMERCIO;145;;CENTRO;CAMPESTRE;57968000;AL
PREFEITURA MUNICIPAL DE CAMPO ALEGRE;PREFEITURA MUNICIPAL DE CAMPO ALEGRE;12264628000183;RUA SENADOR MAXIMO;35;;CENTRO;CAMPO ALEGRE;57250000;AL
PREFEITURA MUNICIPAL DE CAMPO GRANDE;PREFEITURA MUNICIPAL DE CAMPO GRANDE;12198701000166;RUA 31 DE MAIO;96;;CENTRO;CAMPO GRANDE;57350000;AL
PREFEITURA MUNICIPAL DE CANAPI;PREFEITURA MUNICIPAL DE CANAPI;12367892000142;AV JOAQUIM TETE;S/N;;CENTRO;CANAPI;57530000;AL
PREFEITURA MUNICIPAL DE CAPELA;PREFEITURA MUNICIPAL DE CAPELA;12333753000106;RUA PEDRO PAULINO;334;;CENTRO;CAPELA;57780000;AL
PREFEITURA MUNICIPAL DE CARNEIROS;PREFEITURA MUNICIPAL DE CARNEIROS;12250684000169;RUA ORMINDO JOAQUIM DE SANTANA;026;;CENTRO;CARNEIROS;57535000;AL
PREFEITURA MUNICIPAL DE CHA PRETA;PREFEITURA MUNICIPAL DE CHA PRETA;12334629000157;RUA CHICO TEIXEIRA;S/N;NAO CONSTA;CENTRO;CHA PRETA;57760000;AL
PREFEITURA MUNICIPAL DE COITE DO NOIA;PREFEITURA MUNICIPAL DE COITE DO NOIA;12198719000168;PRACA ANTONIO PEDRO DE ALBUQUERQUE;139;;CENTRO;COITE DO NOIA;57325000;AL
PREFEITURA MUNICIPAL DE COLONIA LEOPOLDINA;PREFEITURA MUNICIPAL DE COLONIA LEOPOLDINA;12332987000120;RUA 15 DE NOVEMBRO;S/N;;CENTRO;COLONIA LEOPOLDINA;57975000;AL
PREFEITURA MUNICIPAL DE COQUEIRO SECO;PREFEITURA MUNICIPAL DE COQUEIRO SECO;12200325000105;AV JOAO NAVARRO;61;;CENTRO;COQUEIRO SECO;57140000;AL
PREFEITURA MUNICIPAL DE CORURIPE;PREFEITURA MUNICIPAL DE CORURIPE;12264230000147;PRACA DR CASTRO AZEVEDO;48;;CENTRO;CORURIPE;57230000;AL
PREFEITURA MUNICIPAL DE CRAIBAS;PREFEITURA MUNICIPAL DE CRAIBAS;08439549000199;RUA PEDRO GAMA;122;;CENTRO;CRAIBAS;57320000;AL
PREFEITURA MUNICIPAL DE DELMIRO GOUVEIA;PREFEITURA MUNICIPAL DE DELMIRO GOUVEIA;12224895000127;RUA;222;;CENTRO;DELMIRO GOUVEIA;57480000;AL
PREFEITURA MUNICIPAL DE DOIS RIACHOS;PREFEITURA MUNICIPAL DE DOIS RIACHOS;12250908000132;RUA MIGUEL VIEIRA DE NOVAIS;S/N;;CENTRO;DOIS RIACHOS;57560000;AL
PREFEITURA MUNICIPAL DE ESTRELA DE ALAGOAS;PREFEITURA MUNICIPAL DE ESTRELA DE ALAGOAS;24176307000106;PRACA LUIZ DUARTE;102;;CENTRO;ESTRELA DE ALAGOAS;57625000;AL
PREFEITURA MUNICIPAL DE FEIRA GRANDE;PREFEITURA MUNICIPAL DE FEIRA GRANDE;12207528000115;RUA FREITAS CAVALCANTE;S/N;;CENTRO;FEIRA GRANDE;57340000;AL
PREFEITURA MUNICIPAL DE FELIZ DESERTO;PREFEITURA MUNICIPAL DE FELIZ DESERTO;12242020000158;PRACA DOMINGOS MENDES;178;;CENTRO;FELIZ DESERTO;57220000;AL
PREFEITURA MUNICIPAL DE FLEXEIRAS;PREFEITURA MUNICIPAL DE FLEXEIRAS;12262721000159;RUA CORONEL ALCANTARA;S/N;;CENTRO;FLEXEIRAS;57995000;AL
PREFEITURA MUNICIPAL DE GIRAU DO PONCIANO;PREFEITURA MUNICIPAL DE GIRAU DO PONCIANO;12207536000161;RUA DO SOL;50;PREDIO;CENTRO;GIRAU DO PONCIANO;57360000;AL
PREFEITURA MUNICIPAL DE IBATEGUARA;PREFEITURA MUNICIPAL DE IBATEGUARA;12332961000182;RUA CEL JOAO BEZERRA;25;CENTRO;CENTRO;IBATEGUARA;57890000;AL
PREFEITURA MUNICIPAL DE IGACI;PREFEITURA MUNICIPAL DE IGACI;12228375000192;PRACA ANTONIO TOLEDO;S/N;;CENTRO;IGACI;57620000;AL
PREFEITURA MUNICIPAL DE IGREJA NOVA;PREFEITURA MUNICIPAL DE IGREJA NOVA;12242350000143;PRACA FREI CLEMENTE;S/N;;CENTRO;IGREJA NOVA;57280000;AL
PREFEITURA MUNICIPAL DE INHAPI;PREFEITURA MUNICIPAL DE INHAPI;12226197000160;RUA MUNIZ FALCAO;S/N;;CENTRO;INHAPI;57545000;AL
PREFEITURA MUNICIPAL DE JACARE DOS HOMENS;PREFEITURA MUNICIPAL DE JACARE DOS HOMENS;12250999000106;PRACA JOSE TEOFILO DA SILVA;S/N;;CENTRO;JACARE DOS HOMENS;57430000;AL
PREFEITURA MUNICIPAL DE JACUIPE;PREFEITURA MUNICIPAL DE JACUIPE;12247755000174;RUA PROF MARIO ACIOLY WANDERLEY;S/N;;CENTRO;JACUIPE;57960000;AL
PREFEITURA MUNICIPAL DE JAPARATINGA;PREFEITURA MUNICIPAL DE JAPARATINGA;12247946000136;PRACA NOSSA SENHORA DAS CANDEIAS;S/N;;CENTRO;JAPARATINGA;57950000;AL
PREFEITURA MUNICIPAL DE JARAMATAIA;PREFEITURA MUNICIPAL DE JARAMATAIA;12207544000108;RUA PROFESSOR DERALDO CAMPOS;209;;CENTRO;JARAMATAIA;57425000;AL
PREFEITURA MUNICIPAL DE JEQUIA DA PRAIA;PREFEITURA MUNICIPAL DE JEQUIA DA PRAIA;02917132000108;PRACA JOSE PACHECO;S/N;;CENTRO;JEQUIA DA PRAIA;57255000;AL
PREFEITURA MUNICIPAL DE JOAQUIM GOMES;PREFEITURA MUNICIPAL DE JOAQUIM GOMES;12262739000150;PRACA LAURENTINO GOMES DE BARROS;S/N;;CENTRO;JOAQUIM GOMES;57980000;AL
PREFEITURA MUNICIPAL DE JUNDIA;PREFEITURA MUNICIPAL DE JUNDIA;12248100000110;RUA DO COMERCIO;241;;CENTRO;JUNDIA;57965000;AL
PREFEITURA MUNICIPAL DE JUNQUEIRO;PREFEITURA MUNICIPAL DE JUNQUEIRO;12265468000197;PADRE ANTONIO PROCOPIO;S/N;;CENTRO;JUNQUEIRO;57270000;AL
PREFEITURA MUNICIPAL DE LAGOA DA CANOA;PREFEITURA MUNICIPAL DE LAGOA DA CANOA;12207551000100;PRACA VEREADOR BENICIO A DE OLIVEIRA;S/N;;CENTRO;LAGOA DA CANOA;57330000;AL
PREFEITURA MUNICIPAL DE LIMOEIRO DE ANADIA;PREFEITURA MUNICIPAL DE LIMOEIRO DE ANADIA;12207403000195;RUA JOSE BARBOSA;88;;CENTRO;LIMOEIRO DE ANADIA;57260000;AL
PREFEITURA MUNICIPAL DE MACEIO;PREFEITURA MUNICIPAL DE MACEIO;12200135000180;AV ASSIS CHATEAUBRIAND;2932;;PRADO;MACEIO;57010070;AL
PREFEITURA MUNICIPAL DE MAJOR ISIDORO;PREFEITURA MUNICIPAL DE MAJOR ISIDORO;12228904000158;PRACA LEOPOLDO AMARAL;S/N;;CENTRO;MAJOR ISIDORO;57580000;AL
PREFEITURA MUNICIPAL DE MAR VERMELHO;PREFEITURA MUNICIPAL DE MAR VERMELHO;12333761000144;RUA LADEIRA DA INDEPENDENCIA;S/N;;CENTRO;MAR VERMELHO;57730000;AL
PREFEITURA MUNICIPAL DE MARAGOGI;PREFEITURA MUNICIPAL DE MARAGOGI;12248522000196;PRACA GUEDES DE MIRANDA;30;;CENTRO;MARAGOGI;57955000;AL
PREFEITURA MUNICIPAL DE MARAVILHA;PREFEITURA MUNICIPAL DE MARAVILHA;12251286000167;PRACA FRANCISCO SOARES;29;;CENTRO;MARAVILHA;57520000;AL
PREFEITURA MUNICIPAL DE MARECHAL DEODORO;PREFEITURA MUNICIPAL DE MARECHAL DEODORO;12200275000158;PREFEITURA MUNICIPAL DE MARECHAL DEODORO;SN;;CENTRO;MARECHAL DEODORO;57160000;AL
PREFEITURA MUNICIPAL DE MARIBONDO;PREFEITURA MUNICIPAL DE MARIBONDO;12236873000187;AV SEN ARNON DE MELLO;01;;CENTRO;MARIBONDO;57670000;AL
PREFEITURA MUNICIPAL DE MATA GRANDE;PREFEITURA MUNICIPAL DE MATA GRANDE;12226205000179;RUA UBALDO MALTA;107;;CENTRO;MATA GRANDE;57540000;AL
PREFEITURA MUNICIPAL DE MATRIZ DE CAMARAGIBE;PREFEITURA MUNICIPAL DE MATRIZ DE CAMARAGIBE;12342663000173;PRACA BOM JESUS;20;;CENTRO;MATRIZ DE CAMARAGIBE;57910000;AL
PREFEITURA MUNICIPAL DE MESSIAS;PREFEITURA MUNICIPAL DE MESSIAS;12200283000102;RUA ELPIDIO CAVALCANTE LINS;S/N;;CENTRO;MESSIAS;57990000;AL
PREFEITURA MUNICIPAL DE MINADOR DO NEGRAO;PREFEITURA MUNICIPAL DE MINADOR DO NEGRAO;12237038000161;RUA BELARMINO VIEIRA BARROS;32;;CENTRO;MINADOR DO NEGRAO;57615000;AL
PREFEITURA MUNICIPAL DE MONTEIROPOLIS;PREFEITURA MUNICIPAL DE MONTEIROPOLIS;12251450000136;RUA DO COMERCIO;S/N;;CENTRO;MONTEIROPOLIS;57440000;AL
PREFEITURA MUNICIPAL DE MURICI;PREFEITURA MUNICIPAL DE MURICI;12332953000136;RUA CORONEL PEDRO ANTONIO MACHADO;S/N;;CAMPO GRNADE;MURICI;57820000;AL
PREFEITURA MUNICIPAL DE NOVO LINO;PREFEITURA MUNICIPAL DE NOVO LINO;12248878000120;RUA DO COMERCIO;46;;CENTRO;NOVO LINO;57970000;AL
PREFEITURA MUNICIPAL DE OLHO D'AGUA DAS FLORES;PREFEITURA MUNICIPAL DE OLHO D'AGUA DAS FLORES;12251468000138;PRAÇA JOSÉ DE SOUZA LEITE;S/N;;CENTRO;OLHO D'AGUA DAS FLORES;57442000;AL
PREFEITURA MUNICIPAL DE OLHO D'AGUA DO CASADO;PREFEITURA MUNICIPAL DE OLHO D'AGUA DO CASADO;12350146000146;PRAÇA NOÉ LEITE;S/N;;CENTRO;OLHO D'AGUA DO CASADO;57470000;AL
PREFEITURA MUNICIPAL DE OLHO D'AGUA GRANDE;PREFEITURA MUNICIPAL DE OLHO D'AGUA GRANDE;12207411000131;RUA DO COMERCIO;32;;CENTRO;OLHO D'AGUA GRANDE;57390000;AL
PREFEITURA MUNICIPAL DE OLIVENCA;PREFEITURA MUNICIPAL DE OLIVENCA;12257762000157;RUA PADRE CICERO;S/N;;CENTRO;OLIVENCA;57550000;AL
PREFEITURA MUNICIPAL DE OURO BRANCO;PREFEITURA MUNICIPAL DE OURO BRANCO;12258141000198;RUA CORONEL LUCENA;744;PREDIO;LUIS GONZAGA DE CARV;OURO BRANCO;57525000;AL
PREFEITURA MUNICIPAL DE PALESTINA;PREFEITURA MUNICIPAL DE PALESTINA;12369872000100;PRACA JOSE TOMAS NONO;S/N;ZONA URBANA;CENTRO;PALESTINA;57410000;AL
PREFEITURA MUNICIPAL DE PAO DE ACUCAR;PREFEITURA MUNICIPAL DE PAO DE ACUCAR;12369880000157;AVENIDA BRAULIO CAVALCANTE;S/N;AVENIDA;CENTRO;PAO DE ACUCAR;57400000;AL
PREFEITURA MUNICIPAL DE PARICONHA;PREFEITURA MUNICIPAL DE PARICONHA;35634435000172;RUA MANOEL FRANCISCO DOS SANTOS;50;;CENTRO;PARICONHA;57475000;AL
PREFEITURA MUNICIPAL DE PARIPUEIRA;PREFEITURA MUNICIPAL DE PARIPUEIRA;35561471000153;RUA ANTONIO PONTES;SN;;CENTRO;PARIPUEIRA;57935000;AL
PREFEITURA MUNICIPAL DE PASSO DE CAMARAGIBE;PREFEITURA MUNICIPAL DE PASSO DE CAMARAGIBE;12342655000127;RUA SAO SEBASTIAO;S/N;;CENTRO;PASSO DE CAMARAGIBE;57930000;AL
PREFEITURA MUNICIPAL DE PAULO JACINTO;PREFEITURA MUNICIPAL DE PAULO JACINTO;12335030000138;RUA FLORIANO PEIXOTO;17;;CENTRO;PAULO JACINTO;57740000;AL
PREFEITURA MUNICIPAL DE PENEDO;PREFEITURA MUNICIPAL DE PENEDO;12243697000100;AV GETULIO VARGAS;S/N;;CENTRO;PENEDO;57200000;AL
PREFEITURA MUNICIPAL DE PIACABUCU;PREFEITURA MUNICIPAL DE PIACABUCU;12247268000101;RUA SANTA LUCIA;127;;CENTRO;PIACABUCU;57210000;AL
PREFEITURA MUNICIPAL DE PILAR;PREFEITURA MUNICIPAL DE PILAR;12200150000128;PRACA FLORIANO PEIXOTO;S/N;;CENTRO;PILAR;57150000;AL
PREFEITURA MUNICIPAL DE PINDOBA;PREFEITURA MUNICIPAL DE PINDOBA;12335436000110;RUA DO COMERCIO;31;;CENTRO;PINDOBA;57720000;AL
PREFEITURA MUNICIPAL DE PIRANHAS;PREFEITURA MUNICIPAL DE PIRANHAS;12225546000120;PRACA TABIRA DE BRITO;04;;CENTRO;PIRANHAS;57460000;AL
PREFEITURA MUNICIPAL DE POCO DAS TRINCHEIRAS;PREFEITURA MUNICIPAL DE POCO DAS TRINCHEIRAS;12259040000131;RUA SAO JOSE;S/N;;CENTRO;POCO DAS TRINCHEIRAS;57510000;AL
PREFEITURA MUNICIPAL DE PORTO CALVO;PREFEITURA MUNICIPAL DE PORTO CALVO;12366720000154;RUA DR ANTONIO DORTA;18;;CENTRO;PORTO CALVO;57900000;AL
PREFEITURA MUNICIPAL DE PORTO DE PEDRAS;PREFEITURA MUNICIPAL DE PORTO DE PEDRAS;08629446000191;PRACA NOSSA SENHORA DA GLORIA;S/N;;CENTRO;PORTO DE PEDRAS;57945000;AL
PREFEITURA MUNICIPAL DE PORTO REAL DO COLEGIO;PREFEITURA MUNICIPAL DE PORTO REAL DO COLEGIO;12207429000133;AVADAMERIO VIEIRA DANTAS;505;;CENTRO;PORTO REAL DO COLEGIO;57290000;AL
PREFEITURA MUNICIPAL DE QUEBRANGULO;PREFEITURA MUNICIPAL DE QUEBRANGULO;12241675000101;PCA GERTULIO VARGAS;50;;CENTRO;QUEBRANGULO;57750000;AL
PREFEITURA MUNICIPAL DE RIO LARGO;PREFEITURA MUNICIPAL DE RIO LARGO;12200168000120;RUA 15 DE AGOSTO;S/N;;CENTRO;RIO LARGO;57100000;AL
PREFEITURA MUNICIPAL DE SANTA LUZIA DO NORTE;PREFEITURA MUNICIPAL DE SANTA LUZIA DO NORTE;12200317000150;RUA ESTEVAO P DE BRITO;84;;CENTRO;SANTA LUZIA DO NORTE;57130000;AL
PREFEITURA MUNICIPAL DE SANTANA DO IPANEMA;PREFEITURA MUNICIPAL DE SANTANA DO IPANEMA;12250916000189;RUA CORONEL LUCENA;141;;MONUMENTO;SANTANA DO IPANEMA;57500000;AL
PREFEITURA MUNICIPAL DE SANTANA DO MUNDAU;PREFEITURA MUNICIPAL DE SANTANA DO MUNDAU;12332979000184;RUA SILVESTRE PERICLES;SN;;CENTRO;SANTANA DO MUNDAU;57840000;AL
PREFEITURA MUNICIPAL DE SAO BRAS;PREFEITURA MUNICIPAL DE SAO BRAS;12207437000180;RUA DO COMERCIO;03;;CENTRO;SAO BRAS;57380000;AL
PREFEITURA MUNICIPAL DE SAO JOSE DA LAJE;PREFEITURA MUNICIPAL DE SAO JOSE DA LAJE;12330916000199;AVENIDA VALDEMAR PONTES;S/N;;CENTRO;SAO JOSE DA LAJE;57860000;AL
PREFEITURA MUNICIPAL DE SAO JOSE DA TAPERA;PREFEITURA MUNICIPAL DE SAO JOSE DA TAPERA;12261228000114;RUA DO COMERCIO;S/N;;CENTRO;SAO JOSE DA TAPERA;57445000;AL
PREFEITURA MUNICIPAL DE SAO LUIS DO QUITUNDE;PREFEITURA MUNICIPAL DE SAO LUIS DO QUITUNDE;12342671000110;PRACA VEREADOR A DA SILVA PEDRO;55;;CENTRO;SAO LUIS DO QUITUNDE;57920000;AL
PREFEITURA MUNICIPAL DE SAO MIGUEL DOS CAMPOS;PREFEITURA MUNICIPAL DE SAO MIGUEL DOS CAMPOS;12264222000109;RUA SENADOR MAXIMO;129;;CENTRO;SAO MIGUEL DOS CAMPOS;57240160;AL
PREFEITURA MUNICIPAL DE SAO MIGUEL DOS MILAGRES;PREFEITURA MUNICIPAL DE SAO MIGUEL DOS MILAGRES;12364881000109;RUA VIGARIO BELO;111;;CENTRO;SAO MIGUEL DOS MILAGRES;57940000;AL
PREFEITURA MUNICIPAL DE SAO SEBASTIAO;PREFEITURA MUNICIPAL DE SAO SEBASTIAO;12247631000199;R PEDRO VIEIRA DE BARROS;82;;CENTRO;SAO SEBASTIAO;57275000;AL
PREFEITURA MUNICIPAL DE SATUBA;PREFEITURA MUNICIPAL DE SATUBA;12200333000143;RUA AMELIA PONTES;S/N;;CENTRO;SATUBA;57120000;AL
PREFEITURA MUNICIPAL DE SENADOR RUI PALMEIRA;PREFEITURA MUNICIPAL DE SENADOR RUI PALMEIRA;12421137000107;RUA SANTO ANTONIO;S/N;;CENTRO;SENADOR RUI PALMEIRA;57515000;AL
PREFEITURA MUNICIPAL DE TANQUE D'ARCA;PREFEITURA MUNICIPAL DE TANQUE D'ARCA;12241865000129;PRACA CORONEL FRANCISCO EUCLIDES;S/N;;CENTRO;TANQUE D'ARCA;57635000;AL
PREFEITURA MUNICIPAL DE TAQUARANA;PREFEITURA MUNICIPAL DE TAQUARANA;12207445000126;PRACA JOAO PAULO II;S/N;;CENTRO;TAQUARANA;57640000;AL
PREFEITURA MUNICIPAL DE TEOTONIO VILELA;PREFEITURA MUNICIPAL DE TEOTONIO VILELA;12842829000110;RUA PEDRO CAVALCANTE;156;;CENTRO;TEOTONIO VILELA;57265000;AL
PREFEITURA MUNICIPAL DE TRAIPU;PREFEITURA MUNICIPAL DE TRAIPU;12207452000128;PRACA CONEGO RIBEIRO;60;PREDIO;CENTRO;TRAIPU;57370000;AL
PREFEITURA MUNICIPAL DE UNIAO DOS PALMARES;PREFEITURA MUNICIPAL DE UNIAO DOS PALMARES;12332946000134;CENTRO;S/N;;CENTRO;UNIAO DOS PALMARES;57800000;AL
PREFEITURA MUNICIPAL DE VICOSA;PREFEITURA MUNICIPAL DE VICOSA;12333746000104;RUA DO CENTENARIO;00002;;CENTRO;VICOSA;57700000;AL
PREFEITURA MUNICIPAL DE ALTA FLORESTA D'OESTE;PREFEITURA MUNICIPAL DE ALTA FLORESTA D'OESTE;15834732000154;AV NILO PECANHA;4513;ANEXO;REDONDO;ALTA FLORESTA D'OESTE;76954000;RO
PREFEITURA MUNICIPAL DE ALTO ALEGRE DOS PARECIS;PREFEITURA MUNICIPAL DE ALTO ALEGRE DOS PARECIS;84744994000140;AVENIDA AFONSO PENA;3370;;CENTRO;ALTO ALEGRE DOS PARECIS;76952000;RO
PREFEITURA MUNICIPAL DE ALTO PARAISO;PREFEITURA MUNICIPAL DE ALTO PARAISO;63762025000142;RUA MARECHAL RONDON;3031;;CENTRO;ALTO PARAISO;76862970;RO
PREFEITURA MUNICIPAL DE ALVORADA D'OESTE;PREFEITURA MUNICIPAL DE ALVORADA D'OESTE;15845340000190;RUA CARLOS GOMES;S/N;;CENTRO;ALVORADA D'OESTE;76930000;RO
PREFEITURA MUNICIPAL DE ARIQUEMES;PREFEITURA MUNICIPAL DE ARIQUEMES;04104816000116;AVN RIO MADEIRA;3617;;CENTRO;ARIQUEMES;76872862;RO
PREFEITURA MUNICIPAL DE BURITIS;PREFEITURA MUNICIPAL DE BURITIS;01266058000144;AVN PORTO VELHO;1590;;CENTRO;BURITIS;76880000;RO
PREFEITURA MUNICIPAL DE CABIXI;PREFEITURA MUNICIPAL DE CABIXI;22855159000120;AV TAMOIOS;4887;;CENTRO;CABIXI;76994000;RO
PREFEITURA MUNICIPAL DE CACAULANDIA;PREFEITURA MUNICIPAL DE CACAULANDIA;63762058000192;RUA JOAO BOAVA;1474;;CENTRO;CACAULANDIA;76889000;RO
PREFEITURA MUNICIPAL DE CACOAL;PREFEITURA MUNICIPAL DE CACOAL;04092714000128;RUA ANISIO SERRAO;2100;;CENTRO;CACOAL;76963804;RO
PREFEITURA MUNICIPAL DE CAMPO NOVO DE RONDONIA;PREFEITURA MUNICIPAL DE CAMPO NOVO DE RONDONIA;63762033000199;TANCREDO NEVES;100;;CENTRO;CAMPO NOVO DE RONDONIA;76887000;RO
PREFEITURA MUNICIPAL DE CANDEIAS DO JAMARI;PREFEITURA MUNICIPAL DE CANDEIAS DO JAMARI;63761902000160;AV. TANCREDO NEVES;S/N;;UNIAO;CANDEIAS DO JAMARI;76860000;RO
PREFEITURA MUNICIPAL DE CASTANHEIRAS;PREFEITURA MUNICIPAL DE CASTANHEIRAS;63761969000103;AVENIDA JACARANDA;100;PREDIO;CENTRO;CASTANHEIRAS;76948000;RO
PREFEITURA MUNICIPAL DE CEREJEIRAS;PREFEITURA MUNICIPAL DE CEREJEIRAS;04914925000107;AV N DAS NACOES;1919;;CENTRO;CEREJEIRAS;76997000;RO
PREFEITURA MUNICIPAL DE CHUPINGUAIA;PREFEITURA MUNICIPAL DE CHUPINGUAIA;01587887000129;AV 27;1133;;CENTRO;CHUPINGUAIA;76990000;RO
PREFEITURA MUNICIPAL DE COLORADO DO OESTE;PREFEITURA MUNICIPAL DE COLORADO DO OESTE;04391512000187;AV PAULO DE ASSIS RIBEIRO;S/N;;CENTRO;COLORADO DO OESTE;76993000;RO
PREFEITURA MUNICIPAL DE CORUMBIARA;PREFEITURA MUNICIPAL DE CORUMBIARA;63762041000135;AV OLAVO PIRES;S/N;;CENTRO;CORUMBIARA;76995000;RO
PREFEITURA MUNICIPAL DE COSTA MARQUES;PREFEITURA MUNICIPAL DE COSTA MARQUES;04100020000195;AV CHIANCA;1381;SETOR 01;CENTRO;COSTA MARQUES;76937000;RO
PREFEITURA MUNICIPAL DE CUJUBIM;PREFEITURA MUNICIPAL DE CUJUBIM;84736941000188;RUA CONDOR;S/N;;CENTRO;CUJUBIM;76864000;RO
PREFEITURA MUNICIPAL DE ESPIGAO D'OESTE;PREFEITURA MUNICIPAL DE ESPIGAO D'OESTE;04695284000139;RUA RIO GRANDE DO SUL;2800;;VISTA ALEGRE;ESPIGAO D'OESTE;76974000;RO
PREFEITURA MUNICIPAL DE GOVERNADOR JORGE TEIXEIRA;PREFEITURA MUNICIPAL DE GOVERNADOR JORGE TEIXEIRA;63761944000100;AV PEDRAS BRANCAS;273;;CENTRO;GOVERNADOR JORGE TEIXEIRA;76898000;RO
PREFEITURA MUNICIPAL DE GUAJARA-MIRIM;PREFEITURA MUNICIPAL DE GUAJARA-MIRIM;05893631000109;AVN. 15 DE NOVEMBRO;S/N;;CENTRO;GUAJARA-MIRIM;76850000;RO
PREFEITURA MUNICIPAL DE ITAPUA DO OESTE;PREFEITURA MUNICIPAL DE ITAPUA DO OESTE;63761936000155;AV: AIRTON SENA;1881;;CENTRO;ITAPUA DO OESTE;76861000;RO
PREFEITURA MUNICIPAL DE JARU;PREFEITURA MUNICIPAL DE JARU;04279238000159;RUA RAIMUNDO CANTANHEDE;S/N;;CENTRO;JARU;76890000;RO
PREFEITURA MUNICIPAL DE JI-PARANA;PREFEITURA MUNICIPAL DE JI-PARANA;04092672000125;AV 2 DE ABRIL;1101;;URUPA;JI-PARANA;76900020;RO
PREFEITURA MUNICIPAL DE MACHADINHO D'OESTE;PREFEITURA MUNICIPAL DE MACHADINHO D'OESTE;22855142000173;AV RIO DE JANEIRO;3098;;CENTRO;MACHADINHO D'OESTE;76868000;RO
PREFEITURA MUNICIPAL DE MINISTRO ANDREAZZA;PREFEITURA MUNICIPAL DE MINISTRO ANDREAZZA;63762074000185;AV PAU BRASIL;S/N;;CENTRO;MINISTRO ANDREAZZA;76919000;RO
PREFEITURA MUNICIPAL DE MIRANTE DA SERRA;PREFEITURA MUNICIPAL DE MIRANTE DA SERRA;63787071000104;AV PEDRO II;2389;;CENTRO;MIRANTE DA SERRA;76926000;RO
PREFEITURA MUNICIPAL DE MONTE NEGRO;PREFEITURA MUNICIPAL DE MONTE NEGRO;63761985000198;RUA MARECHAL CANDIDO RONDON;S/N;;CENTRO;MONTE NEGRO;76888000;RO
PREFEITURA MUNICIPAL DE NOVA BRASILANDIA D'OESTE;PREFEITURA MUNICIPAL DE NOVA BRASILANDIA D'OESTE;15884109000106;RUA RIACHUELO;3284;;SETOR 14;NOVA BRASILANDIA D'OESTE;76958000;RO
PREFEITURA MUNICIPAL DE NOVA MAMORE;PREFEITURA MUNICIPAL DE NOVA MAMORE;22855183000160;AV DOM PEDRO II;7096;;JOAO FRANCISCO CLIMA;NOVA MAMORE;76857000;RO
PREFEITURA MUNICIPAL DE NOVA UNIAO;PREFEITURA MUNICIPAL DE NOVA UNIAO;00699197000107;RUA DUQUE DE CAXIAS1158;1158;;CENTRO;NOVA UNIAO;76924000;RO
PREFEITURA MUNICIPAL DE NOVO HORIZONTE DO OESTE;PREFEITURA MUNICIPAL DE NOVO HORIZONTE DO OESTE;63762009000150;AV ELZA VIEIRA;4803;CENTRO;CENTRO;NOVO HORIZONTE DO OESTE;76956000;RO
PREFEITURA MUNICIPAL DE OURO PRETO DO OESTE;PREFEITURA MUNICIPAL DE OURO PRETO DO OESTE;04380507000179;AV DANIEL COMBONI;1480;;UNIAO;OURO PRETO DO OESTE;76920000;RO
PREFEITURA MUNICIPAL DE PARECIS;PREFEITURA MUNICIPAL DE PARECIS;84745363000146;RUA JAIR DIAS;12;;CENTRO;PARECIS;76979000;RO
PREFEITURA MUNICIPAL DE PIMENTA BUENO;PREFEITURA MUNICIPAL DE PIMENTA BUENO;04092680000171;AV CASTELO BRANCO;1046;;CENTRO;PIMENTA BUENO;76970000;RO
PREFEITURA MUNICIPAL DE PIMENTEIRAS DO OESTE;PREFEITURA MUNICIPAL DE PIMENTEIRAS DO OESTE;01592473000198;AV BRASIL;S/N;;CENTRO;PIMENTEIRAS DO OESTE;76999000;RO
PREFEITURA MUNICIPAL DE PORTO VELHO;PREFEITURA MUNICIPAL DE PORTO VELHO;05903125000145;AVENIDA CALAMA;4008;;EMBRATEL;PORTO VELHO;76820739;RO
PREFEITURA MUNICIPAL DE PRESIDENTE MEDICI;PREFEITURA MUNICIPAL DE PRESIDENTE MEDICI;04632212000142;AV SAO JOAO BATISTA;1613;;CENTRO;PRESIDENTE MEDICI;76916000;RO
PREFEITURA MUNICIPAL DE PRIMAVERA DE RONDONIA;PREFEITURA MUNICIPAL DE PRIMAVERA DE RONDONIA;84723030000116;RUA JONAS ANTONIO DE SOUZA;1466;;CENTRO;PRIMAVERA DE RONDONIA;76976970;RO
PREFEITURA MUNICIPAL DE RIO CRESPO;PREFEITURA MUNICIPAL DE RIO CRESPO;63761977000141;AVN ERMELINDO MILANI;1040;;CENTRO;RIO CRESPO;76863000;RO
PREFEITURA MUNICIPAL DE ROLIM DE MOURA;PREFEITURA MUNICIPAL DE ROLIM DE MOURA;04394805000118;AVN JOAO PESSOA;4478;;CENTRO;ROLIM DE MOURA;76940000;RO
PREFEITURA MUNICIPAL DE SANTA LUZIA D'OESTE;PREFEITURA MUNICIPAL DE SANTA LUZIA D'OESTE;15845365000194;RUA 07 DE SETEMBRO;2370;;CENTRO;SANTA LUZIA D'OESTE;76950000;RO
PREFEITURA MUNICIPAL DE SAO FELIPE D'OESTE;PREFEITURA MUNICIPAL DE SAO FELIPE D'OESTE;84745389000194;RUA THEODORO RODRIGUES DA SILVA;667;;CENTRO;SAO FELIPE D'OESTE;76977000;RO
PREFEITURA MUNICIPAL DE SAO FRANCISCO DO GUAPORE;PREFEITURA MUNICIPAL DE SAO FRANCISCO DO GUAPORE;01254422000156;AVENIDA BRASIL;00;PREDIO;ALTO ALEGRE;SAO FRANCISCO DO GUAPORE;76935000;RO
PREFEITURA MUNICIPAL DE SAO MIGUEL DO GUAPORE;PREFEITURA MUNICIPAL DE SAO MIGUEL DO GUAPORE;22855167000177;RUA VALDEMAR COELHO;2340;;CENTRO;SAO MIGUEL DO GUAPORE;76932000;RO
PREFEITURA MUNICIPAL DE SERINGUEIRAS;PREFEITURA MUNICIPAL DE SERINGUEIRAS;63761993000134;AV. JORGE TEIXEIRA;935;;CENTRO;SERINGUEIRAS;76934000;RO
PREFEITURA MUNICIPAL DE TEIXEIROPOLIS;PREFEITURA MUNICIPAL DE TEIXEIROPOLIS;84722933000182;AV AFONSO PENA;2280;;CENTRO;TEIXEIROPOLIS;76928000;RO
PREFEITURA MUNICIPAL DE THEOBROMA;PREFEITURA MUNICIPAL DE THEOBROMA;84727601000190;AVENIDA 13 DE FEVEREIRO;1431;;CENTRO;THEOBROMA;76866000;RO
PREFEITURA MUNICIPAL DE URUPA;PREFEITURA MUNICIPAL DE URUPA;63787097000144;AV. JORGE TEIXEIRA;4872;;ALTO ALEGRE;URUPA;76929000;RO
PREFEITURA MUNICIPAL DE VALE DO ANARI;PREFEITURA MUNICIPAL DE VALE DO ANARI;84722917000190;AV CAPITAO SILVIO DE FARIAS;4571;;CENTRO;VALE DO ANARI;76867000;RO
