PREFEITURA MUNICIPAL DE ABADIA DE GOIAS;PREFEITURA MUNICIPAL DE ABADIA DE GOIAS;01613940000119;AV PAU BRASIL;S/N;;JARDIM NOVA ABADIA;ABADIA DE GOIAS;75345000;GO
PREFEITURA MUNICIPAL DE ABADIANIA;PREFEITURA MUNICIPAL DE ABADIANIA;01298330000178;AV GERALDO RODRIGUES DOS SANTOS;712;;CENTRO;ABADIANIA;72940000;GO
PREFEITURA MUNICIPAL DE ACREUNA;PREFEITURA MUNICIPAL DE ACREUNA;02218683000183;AV PIRES ARANTES;14;;CENTRO;ACREUNA;75960000;GO
PREFEITURA MUNICIPAL DE ADELANDIA;PREFEITURA MUNICIPAL DE ADELANDIA;25108291000167;AV ANICUNS;140;;CENTRO;ADELANDIA;76155000;GO
PREFEITURA MUNICIPAL DE AGUA FRIA DE GOIAS;PREFEITURA MUNICIPAL DE AGUA FRIA DE GOIAS;25141292000103;AVENIDA JOAO ORIVE RODRIGUES;01;QD 32;CENTRO;AGUA FRIA DE GOIAS;73780000;GO
PREFEITURA MUNICIPAL DE AGUA LIMPA;PREFEITURA MUNICIPAL DE AGUA LIMPA;01173053000177;RUA ADOLFO ROSA;S/N;;CENTRO;AGUA LIMPA;75665000;GO
PREFEITURA MUNICIPAL DE AGUAS LINDAS DE GOIAS;PREFEITURA MUNICIPAL DE AGUAS LINDAS DE GOIAS;01616520000196;AV II;S/N;AE N 4;JARDIM QUERENCIA;AGUAS LINDAS DE GOIAS;72910001;GO
PREFEITURA MUNICIPAL DE ALEXANIA;PREFEITURA MUNICIPAL DE ALEXANIA;01298975000100;AV BRASILIA;338;;CENTRO;ALEXANIA;72930000;GO
PREFEITURA MUNICIPAL DE ALOANDIA;PREFEITURA MUNICIPAL DE ALOANDIA;01345537000156;PRACA PEDRO CIRIACO DIAS;01;;CENTRO;ALOANDIA;75615000;GO
PREFEITURA MUNICIPAL DE ALTO PARAISO DE GOIAS;PREFEITURA MUNICIPAL DE ALTO PARAISO DE GOIAS;01740455000106;RUA SAO JOSE OPERARIO;SN;;PARAISINHO;ALTO PARAISO DE GOIAS;73770000;GO
PREFEITURA MUNICIPAL DE ALVORADA DO NORTE;PREFEITURA MUNICIPAL DE ALVORADA DO NORTE;02367597000132;AV DONA GERCINA RODRIGUES;S/N;;NOVO IPIRANGA;ALVORADA DO NORTE;73950000;GO
PREFEITURA MUNICIPAL DE AMARALINA;PREFEITURA MUNICIPAL DE AMARALINA;01492098000104;AVENIDA ANTONIO ALIPIO DIAS;03;;CENTRO;AMARALINA;76493000;GO
PREFEITURA MUNICIPAL DE AMERICANO DO BRASIL;PREFEITURA MUNICIPAL DE AMERICANO DO BRASIL;00007344000122;RUA TRES PODERES;S/N;;CENTRO;AMERICANO DO BRASIL;76165000;GO
PREFEITURA MUNICIPAL DE AMORINOPOLIS;PREFEITURA MUNICIPAL DE AMORINOPOLIS;01067073000163;LOC PCA DA MATRIZ;S/N;;CENTRO;AMORINOPOLIS;76140000;GO
PREFEITURA MUNICIPAL DE ANAPOLIS;PREFEITURA MUNICIPAL DE ANAPOLIS;01067479000146;AV BRASIL;200;;CENTRO;ANAPOLIS;75123020;GO
PREFEITURA MUNICIPAL DE ANHANGUERA;PREFEITURA MUNICIPAL DE ANHANGUERA;01127430000131;AVENIDA BELCHIOR DE GODOY;152;;CENTRO;ANHANGUERA;75770000;GO
PREFEITURA MUNICIPAL DE ANICUNS;PREFEITURA MUNICIPAL DE ANICUNS;02262368000153;AV TOCANTINS;S/N;;CENTRO;ANICUNS;76170000;GO
PREFEITURA MUNICIPAL DE APARECIDA DO RIO DOCE;PREFEITURA MUNICIPAL DE APARECIDA DO RIO DOCE;24859316000100;RUA ADALTO FERNANDES;201;;CENTRO;APARECIDA DO RIO DOCE;75827000;GO
PREFEITURA MUNICIPAL DE APORE;PREFEITURA MUNICIPAL DE APORE;02186336000116;R ARY PIMENTA;313;;CENTRO;APORE;75825000;GO
PREFEITURA MUNICIPAL DE ARACU;PREFEITURA MUNICIPAL DE ARACU;01318898000103;RUA PARA;S/N;;CENTRO;ARACU;75410000;GO
PREFEITURA MUNICIPAL DE ARAGARCAS;PREFEITURA MUNICIPAL DE ARAGARCAS;02125227000199;AVN GETULIO VARGAS;06;;CENTRO;ARAGARCAS;76240000;GO
PREFEITURA MUNICIPAL DE ARAGOIANIA;PREFEITURA MUNICIPAL DE ARAGOIANIA;01215474000113;AV BRASILIA;37;;CENTRO;ARAGOIANIA;75330000;GO
PREFEITURA MUNICIPAL DE ARAGUAPAZ;PREFEITURA MUNICIPAL DE ARAGUAPAZ;00163147000100;AVD GOIAS;415;;CENTRO;ARAGUAPAZ;76720000;GO
PREFEITURA MUNICIPAL DE ARENOPOLIS;PREFEITURA MUNICIPAL DE ARENOPOLIS;00007914000184;R GABRIEL RAIMUNDO DE SOUSA;555;;CENTRO;ARENOPOLIS;76235000;GO
PREFEITURA MUNICIPAL DE ARUANA;PREFEITURA MUNICIPAL DE ARUANA;01067081000100;PRACA COUTO MAGALHAES;22;;CENTRO;ARUANA;76710000;GO
PREFEITURA MUNICIPAL DE AURILANDIA;PREFEITURA MUNICIPAL DE AURILANDIA;02320364000184;AV CAPITAO JOAO GOMES PORTO;260;CENTRO;CENTRO;AURILANDIA;76120000;GO
PREFEITURA MUNICIPAL DE AVELINOPOLIS;PREFEITURA MUNICIPAL DE AVELINOPOLIS;01215839000100;AV ANICUNS;SN;;CENTRO;AVELINOPOLIS;75395000;GO
PREFEITURA MUNICIPAL DE BALIZA;PREFEITURA MUNICIPAL DE BALIZA;01067131000159;PRACA DA MATRIZ;200;;CENTRO;BALIZA;76250000;GO
PREFEITURA MUNICIPAL DE BARRO ALTO;PREFEITURA MUNICIPAL DE BARRO ALTO;02355675000189;PRACA TRES PODRES;S/N;;CENTRO;BARRO ALTO;76390000;GO
PREFEITURA MUNICIPAL DE BELA VISTA DE GOIAS;PREFEITURA MUNICIPAL DE BELA VISTA DE GOIAS;01005917000141;RUA CEL JOAO CAMILO;338;;CENTRO;BELA VISTA DE GOIAS;75240000;GO
PREFEITURA MUNICIPAL DE BOM JARDIM DE GOIAS;PREFEITURA MUNICIPAL DE BOM JARDIM DE GOIAS;02186708000104;PRACA DA MATRIZ;S/N;;CENTRO;BOM JARDIM DE GOIAS;76245000;GO
PREFEITURA MUNICIPAL DE BOM JESUS DE GOIAS;PREFEITURA MUNICIPAL DE BOM JESUS DE GOIAS;01149624000138;PC SEBASTIAO ANTONIO DE OLIVEIRA;33;;CENTRO;BOM JESUS DE GOIAS;75570000;GO
PREFEITURA MUNICIPAL DE BONFINOPOLIS;PREFEITURA MUNICIPAL DE BONFINOPOLIS;24857096000177;RUA 1 C RUA 5;593;;CENTRO;BONFINOPOLIS;75195000;GO
PREFEITURA MUNICIPAL DE BONOPOLIS;PREFEITURA MUNICIPAL DE BONOPOLIS;01634272000106;AV INDEPENDENCIA;SN;;CENTRO;BONOPOLIS;76555000;GO
PREFEITURA MUNICIPAL DE BRAZABRANTES;PREFEITURA MUNICIPAL DE BRAZABRANTES;01756741000160;AV AURELIANO CAETANO MACHADO;SN;;CENTRO;BRAZABRANTES;75440000;GO
PREFEITURA MUNICIPAL DE BRITANIA;PREFEITURA MUNICIPAL DE BRITANIA;02296325000199;AV BRASILIA;100;;CENTRO;BRITANIA;76280000;GO
PREFEITURA MUNICIPAL DE BURITI ALEGRE;PREFEITURA MUNICIPAL DE BURITI ALEGRE;01345909000144;RUA GOIS;563;;CENTRO;BURITI ALEGRE;75660000;GO
PREFEITURA MUNICIPAL DE BURITI DE GOIAS;PREFEITURA MUNICIPAL DE BURITI DE GOIAS;26867770000120;AVN JK;S/N;;CENTRO;BURITI DE GOIAS;76152000;GO
PREFEITURA MUNICIPAL DE BURITINOPOLIS;PREFEITURA MUNICIPAL DE BURITINOPOLIS;24856569000111;AVENIDA PRINCIPAL;S/N;;CENTRO;BURITINOPOLIS;73975000;GO
PREFEITURA MUNICIPAL DE CABECEIRAS;PREFEITURA MUNICIPAL DE CABECEIRAS;01740430000102;AVN VICENTE DE PAULA DE SOUZA;S/N;;CENTRO;CABECEIRAS;73870000;GO
PREFEITURA MUNICIPAL DE CACHOEIRA ALTA;PREFEITURA MUNICIPAL DE CACHOEIRA ALTA;02056760000146;PRACA ADELINO PAULA DE OLIVEIRA;116;;CENTRO;CACHOEIRA ALTA;75870000;GO
PREFEITURA MUNICIPAL DE CACHOEIRA DE GOIAS;PREFEITURA MUNICIPAL DE CACHOEIRA DE GOIAS;02164820000144;RUA CEL SEABRA GUIMARAES;321;;CENTRO;CACHOEIRA DE GOIAS;76125000;GO
PREFEITURA MUNICIPAL DE CACHOEIRA DOURADA;PREFEITURA MUNICIPAL DE CACHOEIRA DOURADA;00079806000117;PRACA TRES PODERES;10;;CENTRO;CACHOEIRA DOURADA;75560000;GO
PREFEITURA MUNICIPAL DE CACU;PREFEITURA MUNICIPAL DE CACU;01164292000160;R JOSE REINALDO VIEIRA;SN;;CENTRO;CACU;75813000;GO
PREFEITURA MUNICIPAL DE CAIAPONIA;PREFEITURA MUNICIPAL DE CAIAPONIA;01164946000156;RUA PEDRO SALAZAR;475;;NOVA CAIAPONIA;CAIAPONIA;75850000;GO
PREFEITURA MUNICIPAL DE CALDAS NOVAS;PREFEITURA MUNICIPAL DE CALDAS NOVAS;01787506000155;AVENIDA ORCALINO SANTOS;283;;CENTRO;CALDAS NOVAS;75680640;GO
PREFEITURA MUNICIPAL DE CALDAZINHA;PREFEITURA MUNICIPAL DE CALDAZINHA;37622149000112;AVENIDA BERNADO SAYAO;476;;CENTRO;CALDAZINHA;75245000;GO
PREFEITURA MUNICIPAL DE CAMPESTRE DE GOIAS;PREFEITURA MUNICIPAL DE CAMPESTRE DE GOIAS;02262236000121;PRAÇA JOAO VITOR;S/N;;CENTRO;CAMPESTRE DE GOIAS;75396000;GO
PREFEITURA MUNICIPAL DE CAMPINACU;PREFEITURA MUNICIPAL DE CAMPINACU;00145789000179;AV. 24 DE OUTUBRO;1;;CENTRO;CAMPINACU;76440000;GO
PREFEITURA MUNICIPAL DE CAMPINORTE;PREFEITURA MUNICIPAL DE CAMPINORTE;02215747000192;PC CRISTOVO COLOMBO;SN;;CENTRO;CAMPINORTE;76410000;GO
PREFEITURA MUNICIPAL DE CAMPO ALEGRE DE GOIAS;PREFEITURA MUNICIPAL DE CAMPO ALEGRE DE GOIAS;01763614000198;PRACA MANOEL PIO PEREIRA;01;;CENTRO;CAMPO ALEGRE DE GOIAS;75795000;GO
PREFEITURA MUNICIPAL DE CAMPO LIMPO DE GOIAS;PREFEITURA MUNICIPAL DE CAMPO LIMPO DE GOIAS;04216593000189;RUA JERONIMO PARREIRA FILHO;48;;CENTRO;CAMPO LIMPO DE GOIAS;75160000;GO
PREFEITURA MUNICIPAL DE CAMPOS BELOS;PREFEITURA MUNICIPAL DE CAMPOS BELOS;01126143000107;PC JOAO BATISTA CORDEIRO;SN;;CENTRO;CAMPOS BELOS;73840000;GO
PREFEITURA MUNICIPAL DE CAMPOS VERDES;PREFEITURA MUNICIPAL DE CAMPOS VERDES;01493998000176;AV CAMPOS VERDES;01;;CENTRO;CAMPOS VERDES;76515000;GO
PREFEITURA MUNICIPAL DE CARMO DO RIO VERDE;PREFEITURA MUNICIPAL DE CARMO DO RIO VERDE;02542538000153;RUA CONTORNO;S/N;;CENTRO;CARMO DO RIO VERDE;76340000;GO
PREFEITURA MUNICIPAL DE CASTELANDIA;PREFEITURA MUNICIPAL DE CASTELANDIA;37275849000188;AVENIDA RIO VERDE;S/N;;CENTRO;CASTELANDIA;75925000;GO
PREFEITURA MUNICIPAL DE CATALAO;PREFEITURA MUNICIPAL DE CATALAO;01505643000150;RUA NASSIN AGEL;505;;CENTRO;CATALAO;75701050;GO
PREFEITURA MUNICIPAL DE CATURAI;PREFEITURA MUNICIPAL DE CATURAI;01319326000149;PRACA 14 DE NOVEMBRO;211;;CENTRO;CATURAI;75430000;GO
PREFEITURA MUNICIPAL DE CAVALCANTE;PREFEITURA MUNICIPAL DE CAVALCANTE;01738772000198;RUA CRISTA;S/N;;CENTRO;CAVALCANTE;73790000;GO
PREFEITURA MUNICIPAL DE CERES;PREFEITURA MUNICIPAL DE CERES;01131713000157;PRACA CIVICA;S/N;;CENTRO;CERES;76300000;GO
PREFEITURA MUNICIPAL DE CEZARINA;PREFEITURA MUNICIPAL DE CEZARINA;25043530000148;RUA DO COMERCIO;S/N;;CENTRO;CEZARINA;76195000;GO
PREFEITURA MUNICIPAL DE CHAPADAO DO CEU;PREFEITURA MUNICIPAL DE CHAPADAO DO CEU;24859332000194;AV. EMA;S/N;QD. 51;CENTRO;CHAPADAO DO CEU;75828000;GO
PREFEITURA MUNICIPAL DE CIDADE OCIDENTAL;PREFEITURA MUNICIPAL DE CIDADE OCIDENTAL;36862621000121;SQ 10 AREA ESPECIAL;SN;;CENTRO;CIDADE OCIDENTAL;72880452;GO
PREFEITURA MUNICIPAL DE COCALZINHO DE GOIAS;PREFEITURA MUNICIPAL DE COCALZINHO DE GOIAS;36985463000105;AV SAO PAULO ESQ C/ AV 03 DE JULHO;S/N;AREA ESPECIAL;CENTRO;COCALZINHO DE GOIAS;72975000;GO
PREFEITURA MUNICIPAL DE COLINAS DO SUL;PREFEITURA MUNICIPAL DE COLINAS DO SUL;25105255000140;R 15 DE NOVEMBRO;SN;;CENTRO;COLINAS DO SUL;73740000;GO
PREFEITURA MUNICIPAL DE CORREGO DO OURO;PREFEITURA MUNICIPAL DE CORREGO DO OURO;02321115000103;PCA CORDEIRO;40;;CENTRO;CORREGO DO OURO;76145000;GO
PREFEITURA MUNICIPAL DE CORUMBA DE GOIAS;PREFEITURA MUNICIPAL DE CORUMBA DE GOIAS;01118850000151;PC WALDEMAR G TELES;161;;SETOR CENTRAL;CORUMBA DE GOIAS;72960000;GO
PREFEITURA MUNICIPAL DE CORUMBAIBA;PREFEITURA MUNICIPAL DE CORUMBAIBA;01302603000100;RUA SIMON BOLIVAR;58;;SIMON BOLIVAR;CORUMBAIBA;75675000;GO
PREFEITURA MUNICIPAL DE CRISTIANOPOLIS;PREFEITURA MUNICIPAL DE CRISTIANOPOLIS;01180645000116;RUA WILSON DA PAIXAO;01;;CENTRO;CRISTIANOPOLIS;75230000;GO
PREFEITURA MUNICIPAL DE CRIXAS;PREFEITURA MUNICIPAL DE CRIXAS;02382067000163;PRACA INACIO JOSE DE CAMPOS;S/N;;CENTRO;CRIXAS;76510000;GO
PREFEITURA MUNICIPAL DE CROMINIA;PREFEITURA MUNICIPAL DE CROMINIA;02073211000180;PRACA ANTONIO PARREIRA DUARTE;S/N;QD 7;CASTELO BRANCO;CROMINIA;75635000;GO
PREFEITURA MUNICIPAL DE CUMARI;PREFEITURA MUNICIPAL DE CUMARI;01302728000130;PRACA SAO JOAO BATISTA;01;;CENTRO;CUMARI;75760000;GO
PREFEITURA MUNICIPAL DE DAMIANOPOLIS;PREFEITURA MUNICIPAL DE DAMIANOPOLIS;01740505000155;AVENIDA GOIAS;S/N;;CENTRO;DAMIANOPOLIS;73980000;GO
PREFEITURA MUNICIPAL DE DAMOLANDIA;PREFEITURA MUNICIPAL DE DAMOLANDIA;01067164000107;PRACA HUGO COSTA;01;;VILA MINEIRA;DAMOLANDIA;75420000;GO
PREFEITURA MUNICIPAL DE DAVINOPOLIS;PREFEITURA MUNICIPAL DE DAVINOPOLIS;01130277000100;RUA DOIS IRMAOS;01;;CENTRO;DAVINOPOLIS;75730000;GO
PREFEITURA MUNICIPAL DE DIORAMA;PREFEITURA MUNICIPAL DE DIORAMA;01335363000140;AVN DEPUTADO JOSE DE ASSIS;S/N;;CENTRO;DIORAMA;76260000;GO
PREFEITURA MUNICIPAL DE DIVINOPOLIS DE GOIAS;PREFEITURA MUNICIPAL DE DIVINOPOLIS DE GOIAS;01067206000100;PRACA SAO JOAO BATISTA SN - CENTRO;SN;;CENTRO;DIVINOPOLIS DE GOIAS;73865000;GO
PREFEITURA MUNICIPAL DE DOVERLANDIA;PREFEITURA MUNICIPAL DE DOVERLANDIA;00078790000128;RUA JK;0;QD65 LT01;CENTRO;DOVERLANDIA;75855000;GO
PREFEITURA MUNICIPAL DE EDEALINA;PREFEITURA MUNICIPAL DE EDEALINA;24852618000148;RUA 21;S/N;QD 04;CENTRO;EDEALINA;75945000;GO
PREFEITURA MUNICIPAL DE EDEIA;PREFEITURA MUNICIPAL DE EDEIA;01788082000143;AV. WASHINGTON LUIZ;S/N;;CENTRO;EDEIA;75940000;GO
PREFEITURA MUNICIPAL DE ESTRELA DO NORTE;PREFEITURA MUNICIPAL DE ESTRELA DO NORTE;01800465000190;AV. BERNANRDO SAYAO;961;CENTRO;CENTRO;ESTRELA DO NORTE;76485000;GO
PREFEITURA MUNICIPAL DE FAINA;PREFEITURA MUNICIPAL DE FAINA;25141318000113;AV LINO NASCIMENTO;157;;CENTRO;FAINA;76740000;GO
PREFEITURA MUNICIPAL DE FAZENDA NOVA;PREFEITURA MUNICIPAL DE FAZENDA NOVA;01915313000132;,;551;;CENTRO;FAZENDA NOVA;76220000;GO
PREFEITURA MUNICIPAL DE FIRMINOPOLIS;PREFEITURA MUNICIPAL DE FIRMINOPOLIS;02321917000113;AV GOIANIA;322;;CENTRO;FIRMINOPOLIS;76105000;GO
PREFEITURA MUNICIPAL DE FLORES DE GOIAS;PREFEITURA MUNICIPAL DE FLORES DE GOIAS;01740497000147;PCA DA MATRIZ;S/N;;CENTRO;FLORES DE GOIAS;73890000;GO
PREFEITURA MUNICIPAL DE FORMOSA;PREFEITURA MUNICIPAL DE FORMOSA;01738780000134;PC RUI BARBOSA;208;;CENTRO;FORMOSA;73801220;GO
PREFEITURA MUNICIPAL DE FORMOSO;PREFEITURA MUNICIPAL DE FORMOSO;02395812000109;PRACA VER NILDA;S/N;;CENTRO;FORMOSO;76470000;GO
PREFEITURA MUNICIPAL DE GAMELEIRA DE GOIAS;PREFEITURA MUNICIPAL DE GAMELEIRA DE GOIAS;04223461000184;AVENIDA 03;438;QUADRA 3 A;CENTRO;GAMELEIRA DE GOIAS;75184000;GO
PREFEITURA MUNICIPAL DE GOIANAPOLIS;PREFEITURA MUNICIPAL DE GOIANAPOLIS;02506012000118;AVENIDA CAMARA FILHO;353;;CENTRO;GOIANAPOLIS;75170000;GO
PREFEITURA MUNICIPAL DE GOIANDIRA;PREFEITURA MUNICIPAL DE GOIANDIRA;01303221000100;PRACA JOSE ABDALA;01;;CENTRO;GOIANDIRA;75740000;GO
PREFEITURA MUNICIPAL DE GOIANESIA;PREFEITURA MUNICIPAL DE GOIANESIA;01065846000172;RUA 31;379;;CENTRO;GOIANESIA;76380031;GO
PREFEITURA MUNICIPAL DE GOIANIRA;PREFEITURA MUNICIPAL DE GOIANIRA;01291707000167;AV GOIAS;516;;SETOR CENTRAL;GOIANIRA;75361609;GO
PREFEITURA MUNICIPAL DE GOIAS;PREFEITURA MUNICIPAL DE GOIAS;02295772000123;PCA DA BANDEIRA;1;;CENTRO;GOIAS;76600000;GO
PREFEITURA MUNICIPAL DE GOIATUBA;PREFEITURA MUNICIPAL DE GOIATUBA;01753722000180;RUA SAO FRANCISCO;570;;CENTRO;GOIATUBA;75600000;GO
PREFEITURA MUNICIPAL DE GOUVELANDIA;PREFEITURA MUNICIPAL DE GOUVELANDIA;25040122000132;AV. SETENOPOLIS;359;;CENTRO;GOUVELANDIA;75865000;GO
PREFEITURA MUNICIPAL DE GUAPO;PREFEITURA MUNICIPAL DE GUAPO;01373497000156;AVENIDA CRISTALINA;823;;CENTRO;GUAPO;75350000;GO
PREFEITURA MUNICIPAL DE GUARAITA;PREFEITURA MUNICIPAL DE GUARAITA;26873059000188;RUA VILMAR DE ALMEIDA COELHO;092;;CENTRO;GUARAITA;76690000;GO
PREFEITURA MUNICIPAL DE GUARANI DE GOIAS;PREFEITURA MUNICIPAL DE GUARANI DE GOIAS;01740588000182;AV SAVAGE ALVES DE OLIVEIRA;S/N;;CENTRO;GUARANI DE GOIAS;73910000;GO
PREFEITURA MUNICIPAL DE GUARINOS;PREFEITURA MUNICIPAL DE GUARINOS;01494178000107;AVENIDA JOSELIO RODRIGUES DO NASCIMENTO;32;;CENTRO;GUARINOS;76374000;GO
PREFEITURA MUNICIPAL DE HEITORAI;PREFEITURA MUNICIPAL DE HEITORAI;02296002000103;AV CEL HEITOR;S/N;;CENTRO;HEITORAI;76670000;GO
PREFEITURA MUNICIPAL DE HIDROLANDIA;PREFEITURA MUNICIPAL DE HIDROLANDIA;01105329000180;RUA DIRCEU MENDONCA;S/N;;CENTRO;HIDROLANDIA;75340000;GO
PREFEITURA MUNICIPAL DE HIDROLINA;PREFEITURA MUNICIPAL DE HIDROLINA;01067230000130;AV ANTONIO BRAGA;SN;;CENTRO;HIDROLINA;76375000;GO
PREFEITURA MUNICIPAL DE IACIARA;PREFEITURA MUNICIPAL DE IACIARA;01740448000104;AV ALFREDO NASSER;S/N;QD 27 LOTE 29;CENTRO;IACIARA;73920000;GO
PREFEITURA MUNICIPAL DE INACIOLANDIA;PREFEITURA MUNICIPAL DE INACIOLANDIA;26923755000151;PRC ULISSES GUIMARAES;S/N;;CENTRO;INACIOLANDIA;75550000;GO
PREFEITURA MUNICIPAL DE INDIARA;PREFEITURA MUNICIPAL DE INDIARA;00005959000110;R MIZAEL MACHADO;SN;;CENTRO;INDIARA;75955000;GO
PREFEITURA MUNICIPAL DE INHUMAS;PREFEITURA MUNICIPAL DE INHUMAS;01153030000109;AV WILSON QUIRINO DE ANDRADE;450;;ANHANGUERA;INHUMAS;75407530;GO
PREFEITURA MUNICIPAL DE IPAMERI;PREFEITURA MUNICIPAL DE IPAMERI;01763606000141;AV PANDIA CALOGERAS;84;;CENTRO;IPAMERI;75780000;GO
PREFEITURA MUNICIPAL DE IPIRANGA DE GOIAS;PREFEITURA MUNICIPAL DE IPIRANGA DE GOIAS;04215377000119;AV RAIMUNDO ALVES DE SOUZA;S/N;QD 01 LT UNICO;SETOR INDEPENDENCIA;IPIRANGA DE GOIAS;76304000;GO
PREFEITURA MUNICIPAL DE IPORA;PREFEITURA MUNICIPAL DE IPORA;01157536000188;RUA LAZARO VIEIRA ;S/N;;CENTRO;IPORA;76200000;GO
PREFEITURA MUNICIPAL DE ISRAELANDIA;PREFEITURA MUNICIPAL DE ISRAELANDIA;01067248000132;RUA ANANIAS BARBOSA;S/N;;CENTRO;ISRAELANDIA;76205000;GO
PREFEITURA MUNICIPAL DE ITAGUARI;PREFEITURA MUNICIPAL DE ITAGUARI;24850109000186;AV GOIAS ESQUINA COM PARANA;S/N;S/C;TRES PODERES;ITAGUARI;76650000;GO
PREFEITURA MUNICIPAL DE ITAGUARU;PREFEITURA MUNICIPAL DE ITAGUARU;01067255000134;PRACA JOAQUIM MOREIRA DAMASCENO;735;;CENTRO;ITAGUARU;76660000;GO
PREFEITURA MUNICIPAL DE ITAJA;PREFEITURA MUNICIPAL DE ITAJA;02186757000147;RUA PIO CANTARIDO DE MEDEIROS;441;CASA;CENTRO;ITAJA;75815000;GO
PREFEITURA MUNICIPAL DE ITAPACI;PREFEITURA MUNICIPAL DE ITAPACI;01134808000124;AV FLORESTA;198;;CENTRO;ITAPACI;76360000;GO
PREFEITURA MUNICIPAL DE ITAPIRAPUA;PREFEITURA MUNICIPAL DE ITAPIRAPUA;02024933000144;PRACA MARECHAL RONDON;94;;CENTRO;ITAPIRAPUA;76290000;GO
PREFEITURA MUNICIPAL DE ITAPURANGA;PREFEITURA MUNICIPAL DE ITAPURANGA;01146604000103;RUA 48;900;;CENTRO;ITAPURANGA;76680000;GO
PREFEITURA MUNICIPAL DE ITARUMA;PREFEITURA MUNICIPAL DE ITARUMA;01067271000127;PCA CENTRAL;SN;;CENTRO;ITARUMA;75810000;GO
PREFEITURA MUNICIPAL DE ITAUCU;PREFEITURA MUNICIPAL DE ITAUCU;00167437000114;PRACA ILETE BUENO;285;;CENTRO;ITAUCU;75450000;GO
PREFEITURA MUNICIPAL DE IVOLANDIA;PREFEITURA MUNICIPAL DE IVOLANDIA;02321891000103;AV DEP JAMEL CECILIO;192;;CENTRO;IVOLANDIA;76130000;GO
PREFEITURA MUNICIPAL DE JANDAIA;PREFEITURA MUNICIPAL DE JANDAIA;02879138000138;AV JK DE OLIVEIRA;742;;CENTRO;JANDAIA;75950000;GO
PREFEITURA MUNICIPAL DE JARAGUA;PREFEITURA MUNICIPAL DE JARAGUA;01223916000173;PCA RODRIGUES SUZANO;1;;CENTRO;JARAGUA;76330000;GO
PREFEITURA MUNICIPAL DE JATAI;PREFEITURA MUNICIPAL DE JATAI;01165729000180;RUA ITARUMA;355;QD 58-A;SANTA MARIA;JATAI;75800089;GO
PREFEITURA MUNICIPAL DE JAUPACI;PREFEITURA MUNICIPAL DE JAUPACI;01767342000102;AVN PARANAIBA;81;;CENTRO;JAUPACI;76210000;GO
PREFEITURA MUNICIPAL DE JESUPOLIS;PREFEITURA MUNICIPAL DE JESUPOLIS;37623501000134;PRACA LUIZ DE MATTOS;00100;;CENTRO;JESUPOLIS;75495000;GO
PREFEITURA MUNICIPAL DE JOVIANIA;PREFEITURA MUNICIPAL DE JOVIANIA;02029957000196;RUA JOAQUIM LUIS BARBOSA;266;;CENTRO;JOVIANIA;75610000;GO
PREFEITURA MUNICIPAL DE JUSSARA;PREFEITURA MUNICIPAL DE JUSSARA;02922128000138;AV JOSE BONIFACIO;726;;CENTRO;JUSSARA;76270000;GO
PREFEITURA MUNICIPAL DE LAGOA SANTA;PREFEITURA MUNICIPAL DE LAGOA SANTA;04215178000100;WALDOMIRO TEODORO RIOS;S/N;Q30 LT02;POUSADA DAS NASCENTE;LAGOA SANTA;75819000;GO
PREFEITURA MUNICIPAL DE LEOPOLDO DE BULHOES;PREFEITURA MUNICIPAL DE LEOPOLDO DE BULHOES;01067305000183;PRACA DOM BOSCO;266;;CENTRO;LEOPOLDO DE BULHOES;75190000;GO
PREFEITURA MUNICIPAL DE LUZIANIA;PREFEITURA MUNICIPAL DE LUZIANIA;01169416000109;PRACA NIRSON CARNEIRO LOBO;34;;CENTRO;LUZIANIA;72800970;GO
PREFEITURA MUNICIPAL DE MAIRIPOTABA;PREFEITURA MUNICIPAL DE MAIRIPOTABA;01067842000123;RUA DAS PALMEIRAS;S/N;;CENTRO;MAIRIPOTABA;75630000;GO
PREFEITURA MUNICIPAL DE MAMBAI;PREFEITURA MUNICIPAL DE MAMBAI;01740463000152;RUA COSTA SILVA;S/N;;CENTRO;MAMBAI;73970000;GO
PREFEITURA MUNICIPAL DE MARA ROSA;PREFEITURA MUNICIPAL DE MARA ROSA;00007468000108;PC COSTA E SILVA;378;;CENTRO;MARA ROSA;76490000;GO
PREFEITURA MUNICIPAL DE MARZAGAO;PREFEITURA MUNICIPAL DE MARZAGAO;01174580000104;AV BERNARDO SAYAO;260;;CENTRO;MARZAGAO;75670000;GO
PREFEITURA MUNICIPAL DE MATRINCHA;PREFEITURA MUNICIPAL DE MATRINCHA;24850216000104;RUA JERCIRON PEREIRA DIAS;S/N;;NOVA ESPERANCA;MATRINCHA;76730000;GO
PREFEITURA MUNICIPAL DE MAURILANDIA;PREFEITURA MUNICIPAL DE MAURILANDIA;02056752000108;R ONDINA RODRIGUES C REZENDE;543;;CENTRO;MAURILANDIA;75930000;GO
PREFEITURA MUNICIPAL DE MIMOSO DE GOIAS;PREFEITURA MUNICIPAL DE MIMOSO DE GOIAS;25053430000100;RUA 09 QD 12 LT 09;S/N;;CENTRO;MIMOSO DE GOIAS;73730000;GO
PREFEITURA MUNICIPAL DE MINACU;PREFEITURA MUNICIPAL DE MINACU;02215275000178;AV. AMAZONAS;295;;CENTRO;MINACU;76450000;GO
PREFEITURA MUNICIPAL DE MINEIROS;PREFEITURA MUNICIPAL DE MINEIROS;02316537000190;PRC CORONEL CARRIJO;01;;CENTRO;MINEIROS;75830046;GO
PREFEITURA MUNICIPAL DE MOIPORA;PREFEITURA MUNICIPAL DE MOIPORA;02321909000177;PRC CENTRAL;S/N;;CENTRO;MOIPORA;76135000;GO
PREFEITURA MUNICIPAL DE MONTE ALEGRE DE GOIAS;PREFEITURA MUNICIPAL DE MONTE ALEGRE DE GOIAS;01126341000170;PCA DA MATRIZ;SN;;CENTRO;MONTE ALEGRE DE GOIAS;73830000;GO
PREFEITURA MUNICIPAL DE MONTES CLAROS DE GOIAS;PREFEITURA MUNICIPAL DE MONTES CLAROS DE GOIAS;01767722000139;AV SANTOS DUMONT;511;;CENTRO;MONTES CLAROS DE GOIAS;76255000;GO
PREFEITURA MUNICIPAL DE MONTIVIDIU;PREFEITURA MUNICIPAL DE MONTIVIDIU;25043571000134;AV NEITE OUTTA QD 13;SN;;VERA CRUZ;MONTIVIDIU;75915000;GO
PREFEITURA MUNICIPAL DE MONTIVIDIU DO NORTE;PREFEITURA MUNICIPAL DE MONTIVIDIU DO NORTE;25005166000121;RUA 14;353;;CENTRO;MONTIVIDIU DO NORTE;76465000;GO
PREFEITURA MUNICIPAL DE MORRINHOS;PREFEITURA MUNICIPAL DE MORRINHOS;01789551000149;RUA SENADOR HERMENEGILDO;160;;CENTRO;MORRINHOS;75650000;GO
PREFEITURA MUNICIPAL DE MORRO AGUDO DE GOIAS;PREFEITURA MUNICIPAL DE MORRO AGUDO DE GOIAS;25043621000183;AVENIDA FLAMBOYANT;449;;CENTRO;MORRO AGUDO DE GOIAS;76355000;GO
PREFEITURA MUNICIPAL DE MOSSAMEDES;PREFEITURA MUNICIPAL DE MOSSAMEDES;02267698000131;AVD JOAO FERREIRA DA CUNHA;S/N;;CENTRO;MOSSAMEDES;76150000;GO
PREFEITURA MUNICIPAL DE MOZARLANDIA;PREFEITURA MUNICIPAL DE MOZARLANDIA;01135227000107;RUA SAO PAULO;S/N;;CENTRO;MOZARLANDIA;76700000;GO
PREFEITURA MUNICIPAL DE MUNDO NOVO;PREFEITURA MUNICIPAL DE MUNDO NOVO;00163055000112;AV DOS TAMBORIS;8;;SAO LOURENCA;MUNDO NOVO;76530000;GO
PREFEITURA MUNICIPAL DE MUTUNOPOLIS;PREFEITURA MUNICIPAL DE MUTUNOPOLIS;01799683000151;PRACA CIVICA;263;;ANHANGUERA;MUTUNOPOLIS;76540000;GO
PREFEITURA MUNICIPAL DE NAZARIO;PREFEITURA MUNICIPAL DE NAZARIO;01373620000139;AV INHUMAS;42;PRACA DA BANDEIRA;CENTRO;NAZARIO;76180000;GO
PREFEITURA MUNICIPAL DE NEROPOLIS;PREFEITURA MUNICIPAL DE NEROPOLIS;01105626000125;PCA ANTONIO DULTRA;S/N;;CENTRO;NEROPOLIS;75460000;GO
PREFEITURA MUNICIPAL DE NIQUELANDIA;PREFEITURA MUNICIPAL DE NIQUELANDIA;02215895000107;PA MESTRE DARIO;01;;ST CENTRAL;NIQUELANDIA;76420000;GO
PREFEITURA MUNICIPAL DE NOVA AMERICA;PREFEITURA MUNICIPAL DE NOVA AMERICA;01135409000188;SEM INFORMACAO;S/N;;SEM INFORMACAO;NOVA AMERICA;76345000;GO
PREFEITURA MUNICIPAL DE NOVA AURORA;PREFEITURA MUNICIPAL DE NOVA AURORA;01303619000138;RUA BAHIA;60;;CENTRO;NOVA AURORA;75750000;GO
PREFEITURA MUNICIPAL DE NOVA CRIXAS;PREFEITURA MUNICIPAL DE NOVA CRIXAS;00236968000111;PRACA TRES PODERES;S/N;;CENTRO;NOVA CRIXAS;76520000;GO
PREFEITURA MUNICIPAL DE NOVA GLORIA;PREFEITURA MUNICIPAL DE NOVA GLORIA;00098095000128;PRACA CIVICA;75;;CENTRO;NOVA GLORIA;76305000;GO
PREFEITURA MUNICIPAL DE NOVA IGUACU DE GOIAS;PREFEITURA MUNICIPAL DE NOVA IGUACU DE GOIAS;33331661000159;AV: INDEPENDENCIA;SN;;CENTRO;NOVA IGUACU DE GOIAS;76495000;GO
PREFEITURA MUNICIPAL DE NOVA ROMA;PREFEITURA MUNICIPAL DE NOVA ROMA;01067925000112;PRACA AUGUSTO PIO DE SANTANA;002;;CENTRO;NOVA ROMA;73820000;GO
PREFEITURA MUNICIPAL DE NOVA VENEZA;PREFEITURA MUNICIPAL DE NOVA VENEZA;01123678000124;RUA VEREADOR JOSE FRANCISCO DA SILVA;72;;CENTRO;NOVA VENEZA;75470000;GO
PREFEITURA MUNICIPAL DE NOVO BRASIL;PREFEITURA MUNICIPAL DE NOVO BRASIL;00006874000156;PARQUE CASTELO BRANCO;S/N;;CENTRO;NOVO BRASIL;76285000;GO
PREFEITURA MUNICIPAL DE NOVO GAMA;PREFEITURA MUNICIPAL DE NOVO GAMA;01629276000104;AVENIDA CENTRAL;100;;NOVO GAMA;NOVO GAMA;72860100;GO
PREFEITURA MUNICIPAL DE NOVO PLANALTO;PREFEITURA MUNICIPAL DE NOVO PLANALTO;25041005000193;R SALVADOR;202;;CENTRO;NOVO PLANALTO;76580000;GO
PREFEITURA MUNICIPAL DE ORIZONA;PREFEITURA MUNICIPAL DE ORIZONA;02385839000110;RUA CORONEL JOSE DA COSTA;22;;CENTRO;ORIZONA;75280000;GO
PREFEITURA MUNICIPAL DE OURO VERDE DE GOIAS;PREFEITURA MUNICIPAL DE OURO VERDE DE GOIAS;01485531000184;RUA DAS FLORES;SN;QD AE LT 02;CENTRO;OURO VERDE DE GOIAS;75165000;GO
PREFEITURA MUNICIPAL DE OUVIDOR;PREFEITURA MUNICIPAL DE OUVIDOR;01131010000129;RUA JOAQUIM DA SILVA RIBEIRO;790;;CENTRO;OUVIDOR;75715000;GO
PREFEITURA MUNICIPAL DE PADRE BERNARDO;PREFEITURA MUNICIPAL DE PADRE BERNARDO;01170331000132;R D. PEDRO PRIMEIRO;04;QD 26, SALA 10;CENTRO;PADRE BERNARDO;73700000;GO
PREFEITURA MUNICIPAL DE PALESTINA DE GOIAS;PREFEITURA MUNICIPAL DE PALESTINA DE GOIAS;24858102000100;RUA MANOEL BEIJAMIM DA SILVA;213;;CENTRO;PALESTINA DE GOIAS;75845000;GO
PREFEITURA MUNICIPAL DE PALMEIRAS DE GOIAS;PREFEITURA MUNICIPAL DE PALMEIRAS DE GOIAS;02394757000132;RUA AMERICANO DO BRASIL;149;;CENTRO;PALMEIRAS DE GOIAS;76190000;GO
PREFEITURA MUNICIPAL DE PALMELO;PREFEITURA MUNICIPAL DE PALMELO;01181239000178;AV EMANUEL;435;;CENTRO;PALMELO;75210000;GO
PREFEITURA MUNICIPAL DE PALMINOPOLIS;PREFEITURA MUNICIPAL DE PALMINOPOLIS;01178573000172;RUA PEDRO GERALDO LOPES;11;;CENTRO;PALMINOPOLIS;75990000;GO
PREFEITURA MUNICIPAL DE PANAMA;PREFEITURA MUNICIPAL DE PANAMA;00079830000156;AV GETULIO VARGAS;540;;CENTRO;PANAMA;75580000;GO
PREFEITURA MUNICIPAL DE PARANAIGUARA;PREFEITURA MUNICIPAL DE PARANAIGUARA;02056745000106;AVENIDA PRESIDENTE TANCREDO NEVES;S/N;PRACA DOS TRES PODER;CENTRO;PARANAIGUARA;75880000;GO
PREFEITURA MUNICIPAL DE PARAUNA;PREFEITURA MUNICIPAL DE PARAUNA;02394765000189;PRACA EUGENIO SARDINHA;02;;CENTRO;PARAUNA;75980000;GO
PREFEITURA MUNICIPAL DE PEROLANDIA;PREFEITURA MUNICIPAL DE PEROLANDIA;24859324000148;RUA JOSE ALVES VILELA;S/N;;CENTRO;PEROLANDIA;75823000;GO
PREFEITURA MUNICIPAL DE PETROLINA DE GOIAS;PREFEITURA MUNICIPAL DE PETROLINA DE GOIAS;01825413000178;PRACA TEOFILO VIEIRA MOTA;101;;CENTRO;PETROLINA DE GOIAS;75480000;GO
PREFEITURA MUNICIPAL DE PILAR DE GOIAS;PREFEITURA MUNICIPAL DE PILAR DE GOIAS;02647303000126;RUA VICENTE G MOREIRA;S/N;;CENTRO;PILAR DE GOIAS;76372000;GO
PREFEITURA MUNICIPAL DE PIRACANJUBA;PREFEITURA MUNICIPAL DE PIRACANJUBA;01179647000195;PRACA WILSON ELOY PIMENTA;100;;CENTRO;PIRACANJUBA;75640000;GO
PREFEITURA MUNICIPAL DE PIRANHAS;PREFEITURA MUNICIPAL DE PIRANHAS;01168145000169;AV BRASIL CENTRAL;974;;CENTRO;PIRANHAS;76230000;GO
PREFEITURA MUNICIPAL DE PIRENOPOLIS;PREFEITURA MUNICIPAL DE PIRENOPOLIS;01067941000105;AV COM JOAQUIM ALVES;S/N;;CENTRO;PIRENOPOLIS;72980000;GO
PREFEITURA MUNICIPAL DE PIRES DO RIO;PREFEITURA MUNICIPAL DE PIRES DO RIO;01181585000156;PRACA FRANCISCO FELIPE MACHADO;37;;CENTRO;PIRES DO RIO;75200000;GO
